{"run":99,"commit":"d03d9d9","metric":79,"metrics":{"wall_s":27.7},"status":"keep","description":"feat(stage0): import typ 0066 nested let tuple fixture","timestamp":1779151769756,"segment":2,"confidence":3.8666666666666667,"asi":{"hypothesis":"A nested-let tuple fixture can grow local alias-chain coverage without new compiler features by translating old OCaml nested `let ... in` bindings to equivalent sequential RiotML local bindings.","original_fixture":"compiler/typ/tests/fixtures/corpus/0066_nested_let_tuple.ml","translated_fixture":"compiler/fixtures/programs/imported/typ/0066_nested_let_tuple.ml","feature_added":"No new compiler feature; exercised existing local binding lookup through a two-step alias chain over a tuple value.","dedup_similarity_check":"Normalized nearest distance was 35 to existing if/tuple fixtures and 40 to tuple_with_ident, so this adds meaningful alias-chain coverage rather than a value-only duplicate.","ebnf_consulted":"compiler/riotml.ebnf permits block let_stmt sequences followed by a tail expression/call; old OCaml nested `let ... in` was translated to equivalent sequential RiotML lets because there is no shadowing in this fixture.","validation":"env LLVM_SYS_221_PREFIX=/opt/homebrew/opt/llvm INSTA_UPDATE=always cargo test --manifest-path compiler/stage0/Cargo.toml && env LLVM_SYS_221_PREFIX=/opt/homebrew/opt/llvm cargo test --manifest-path compiler/stage0/Cargo.toml passed","shared_repo_note":"Concurrent actor primitive work was preserved in a stash during validation to avoid committing or reverting another agent's files; restore it after logging."}}
{"run":100,"commit":"crash10","metric":0,"metrics":{"wall_s":16.8},"status":"crash","description":"feat(stage0): try importing syn 0206 record-with-expr fixture","timestamp":1779151918117,"segment":2,"confidence":3.8666666666666667,"asi":{"hypothesis":"The old record_with_expr fixture can now be translated meaningfully using existing record field expression evaluation plus helper-call constant evaluation, exercising arithmetic and calls inside record fields without broad new features.","original_fixture":"compiler/syn/tests/fixtures/0206_record_with_expr.ml","translated_fixture":"compiler/fixtures/programs/imported/syn/0206_record_with_expr.ml","failure":"The new record-with-expr fixture itself passed, but validation failed because concurrent actor fixture/source changes became visible during the run and actor fixtures failed. Several unrelated snapshots were updated to failure before the test stopped.","rollback_reason":"Must not commit or revert another agent's actor work; stashed actor-related source and fixture artifacts before logging, allowing autoresearch to revert only this attempted fixture and failed snapshot updates.","next_action_hint":"Rerun the record-with-expr import with actor work stashed/quiet, or wait for the actor agent to finish if actor files keep reappearing during validation.","shared_repo_note":"Another agent is adding actor primitives; preserve actor work and wait/retry rather than overwriting it."}}
