{"run":50,"commit":"a0bf8b9","metric":50,"metrics":{"wall_s":14.2},"status":"keep","description":"Imported typ 0016 const char a fixture using existing char literal println support","timestamp":1779142537400,"segment":0,"confidence":3.92,"asi":{"hypothesis":"After adding char literal support for choose_char, the simpler const_char_a fixture should compile with no further compiler changes.","original_fixture":"compiler/typ/tests/fixtures/corpus/0016_const_char_a.ml","translated_fixture":"compiler/fixtures/programs/imported/typ/0016_const_char_a.ml","feature_added":"No new compiler feature; exercised a direct local char literal binding and println.","validation":"env LLVM_SYS_221_PREFIX=/opt/homebrew/opt/llvm cargo test --manifest-path compiler/stage0/Cargo.toml passed","suggested_next_fixture":"compiler/typ/tests/fixtures/corpus/0017_const_char_z.ml"}}
{"run":51,"commit":"8690c71","metric":51,"metrics":{"wall_s":15.4},"status":"keep","description":"Imported typ 0017 const char z fixture using existing char literal println support","timestamp":1779142587371,"segment":0,"confidence":3.8461538461538463,"asi":{"hypothesis":"The const_char_z typ fixture should compile with the existing char literal path and adds coverage for another character value without compiler changes.","original_fixture":"compiler/typ/tests/fixtures/corpus/0017_const_char_z.ml","translated_fixture":"compiler/fixtures/programs/imported/typ/0017_const_char_z.ml","feature_added":"No new compiler feature; exercised a direct local char literal binding and println for a different char value.","validation":"env LLVM_SYS_221_PREFIX=/opt/homebrew/opt/llvm cargo test --manifest-path compiler/stage0/Cargo.toml passed","suggested_next_fixture":"compiler/syn/tests/fixtures/0018_char_simple.ml"}}
{"run":52,"commit":"7238fcb","metric":52,"metrics":{"wall_s":14.6},"status":"keep","description":"Imported syn 0018 simple char fixture using existing char literal println support","timestamp":1779142644129,"segment":0,"confidence":3.923076923076923,"asi":{"hypothesis":"After char support landed for typ fixtures, the old syn simple char binding translates directly to a RiotML local char binding and deterministic println.","original_fixture":"compiler/syn/tests/fixtures/0018_char_simple.ml","translated_fixture":"compiler/fixtures/programs/imported/syn/0018_char_simple.ml","feature_added":"No new compiler feature; exercised syn provenance for a direct char literal binding and println.","validation":"env LLVM_SYS_221_PREFIX=/opt/homebrew/opt/llvm cargo test --manifest-path compiler/stage0/Cargo.toml passed","suggested_next_fixture":"compiler/typ/tests/fixtures/corpus/0018_const_float_one.ml"}}
{"run":53,"commit":"b8b2a16","metric":53,"metrics":{"wall_s":83.6},"status":"keep","description":"feat(stage0): import typ 0018 const float fixture with narrow float literal support","timestamp":1779142794780,"segment":0,"confidence":4,"asi":{"hypothesis":"The typ const_float_one fixture is a small next literal feature; storing float constants as their source spelling is enough for deterministic println without adding runtime numeric float operations.","original_fixture":"compiler/typ/tests/fixtures/corpus/0018_const_float_one.ml","translated_fixture":"compiler/fixtures/programs/imported/typ/0018_const_float_one.ml","feature_added":"Parser/checker support for simple decimal float literals; println renders the preserved source spelling.","validation":"env LLVM_SYS_221_PREFIX=/opt/homebrew/opt/llvm cargo test --manifest-path compiler/stage0/Cargo.toml passed","suggested_next_fixture":"compiler/typ/tests/fixtures/corpus/0019_const_float_zero.ml"}}
{"run":54,"commit":"c81d5ed","metric":54,"metrics":{"wall_s":18.9},"status":"keep","description":"feat(stage0): import typ 0019 const float zero fixture","timestamp":1779142852245,"segment":0,"confidence":3.925925925925926,"asi":{"hypothesis":"After adding simple decimal float literal support, the typ const_float_zero fixture should compile with no additional compiler changes and adds coverage for zero-valued floats.","original_fixture":"compiler/typ/tests/fixtures/corpus/0019_const_float_zero.ml","translated_fixture":"compiler/fixtures/programs/imported/typ/0019_const_float_zero.ml","feature_added":"No new compiler feature; exercised existing simple decimal float literal parsing and println rendering for 0.0.","validation":"env LLVM_SYS_221_PREFIX=/opt/homebrew/opt/llvm cargo test --manifest-path compiler/stage0/Cargo.toml passed","suggested_next_fixture":"compiler/syn/tests/fixtures/0012_float_simple.ml"}}
{"run":55,"commit":"5b14e04","metric":55,"metrics":{"wall_s":17.1},"status":"keep","description":"feat(stage0): import syn 0012 simple float fixture","timestamp":1779142904299,"segment":0,"confidence":3.857142857142857,"asi":{"hypothesis":"After simple decimal float literal support landed for typ fixtures, the syn simple float binding should translate directly to a RiotML local binding and deterministic println.","original_fixture":"compiler/syn/tests/fixtures/0012_float_simple.ml","translated_fixture":"compiler/fixtures/programs/imported/syn/0012_float_simple.ml","feature_added":"No new compiler feature; exercised syn provenance for existing simple decimal float literal parsing and println rendering.","validation":"env LLVM_SYS_221_PREFIX=/opt/homebrew/opt/llvm cargo test --manifest-path compiler/stage0/Cargo.toml passed","suggested_next_fixture":"compiler/syn/tests/fixtures/0013_float_negative.ml"}}
{"run":56,"commit":"6e68136","metric":56,"metrics":{"wall_s":16.7},"status":"keep","description":"feat(stage0): import syn 0013 negative float fixture","timestamp":1779142962569,"segment":0,"confidence":3.9285714285714284,"asi":{"hypothesis":"The negative float fixture needs only a narrow extension of existing unary negation to preserved float constants, without adding runtime float arithmetic.","original_fixture":"compiler/syn/tests/fixtures/0013_float_negative.ml","translated_fixture":"compiler/fixtures/programs/imported/syn/0013_float_negative.ml","feature_added":"Checker support for unary - over simple float constants by preserving the negative source spelling for println rendering.","validation":"env LLVM_SYS_221_PREFIX=/opt/homebrew/opt/llvm cargo test --manifest-path compiler/stage0/Cargo.toml passed","suggested_next_fixture":"compiler/syn/tests/fixtures/0014_float_exponent.ml"}}
{"run":57,"commit":"8e796e4","metric":57,"metrics":{"wall_s":92.6},"status":"keep","description":"feat(stage0): import syn 0014 float exponent fixture","timestamp":1779144014612,"segment":0,"confidence":4,"asi":{"hypothesis":"The exponent float fixture requires only extending simple float token parsing to accept a compact RiotML exponent suffix while preserving source spelling for deterministic println.","original_fixture":"compiler/syn/tests/fixtures/0014_float_exponent.ml","translated_fixture":"compiler/fixtures/programs/imported/syn/0014_float_exponent.ml","feature_added":"Parser support for simple decimal float literals with e/E exponent suffixes; old spaced OCaml exponent syntax translated to compact RiotML `1.5e10`.","validation":"env LLVM_SYS_221_PREFIX=/opt/homebrew/opt/llvm cargo test --manifest-path compiler/stage0/Cargo.toml passed","suggested_next_fixture":"compiler/syn/tests/fixtures/0015_float_neg_exponent.ml"}}
{"run":58,"commit":"153d225","metric":58,"metrics":{"wall_s":24.5},"status":"keep","description":"feat(stage0): import syn 0015 negative exponent float fixture","timestamp":1779144124229,"segment":0,"confidence":3.9310344827586206,"asi":{"hypothesis":"The negative-exponent float fixture can be translated from old spaced exponent syntax to compact RiotML `2.0e-5` and should compile using existing exponent float literal support.","original_fixture":"compiler/syn/tests/fixtures/0015_float_neg_exponent.ml","translated_fixture":"compiler/fixtures/programs/imported/syn/0015_float_neg_exponent.ml","feature_added":"No new compiler feature; exercised existing compact e/E float exponent parsing with a negative exponent.","validation":"env LLVM_SYS_221_PREFIX=/opt/homebrew/opt/llvm INSTA_UPDATE=always cargo test --manifest-path compiler/stage0/Cargo.toml && env LLVM_SYS_221_PREFIX=/opt/homebrew/opt/llvm cargo test --manifest-path compiler/stage0/Cargo.toml passed","suggested_next_fixture":"compiler/syn/tests/fixtures/0040_float_add.ml"}}
{"run":59,"commit":"fae82ad","metric":59,"metrics":{"wall_s":104},"status":"keep","description":"feat(stage0): import typ 0003 annotated float fixture","timestamp":1779144287773,"segment":0,"confidence":3.8666666666666667,"asi":{"hypothesis":"A typ annotated float value is a smaller next feature than float arithmetic; accepting and ignoring a simple local type annotation lets stage0 compile the fixture while preserving RiotML syntax and keeping checking narrow.","original_fixture":"compiler/typ/tests/fixtures/corpus/0003_annotated_value_float.ml","translated_fixture":"compiler/fixtures/programs/imported/typ/0003_annotated_value_float.ml","feature_added":"Parser support for optional simple local let type annotations before `=`, ignored by the current constant checker.","validation":"env LLVM_SYS_221_PREFIX=/opt/homebrew/opt/llvm INSTA_UPDATE=always cargo test --manifest-path compiler/stage0/Cargo.toml && env LLVM_SYS_221_PREFIX=/opt/homebrew/opt/llvm cargo test --manifest-path compiler/stage0/Cargo.toml passed","suggested_next_fixture":"compiler/typ/tests/fixtures/corpus/0001_annotated_value_bool.ml"}}
{"run":60,"commit":"c3b56dd","metric":60,"metrics":{"wall_s":31.6},"status":"keep","description":"feat(stage0): import typ 0001 annotated bool fixture","timestamp":1779144364399,"segment":0,"confidence":3.933333333333333,"asi":{"hypothesis":"After simple local let type annotations landed, the annotated bool fixture should compile without additional compiler changes and adds non-float annotation coverage.","original_fixture":"compiler/typ/tests/fixtures/corpus/0001_annotated_value_bool.ml","translated_fixture":"compiler/fixtures/programs/imported/typ/0001_annotated_value_bool.ml","feature_added":"No new compiler feature; exercised existing optional simple local let type annotation parsing with `bool`.","validation":"env LLVM_SYS_221_PREFIX=/opt/homebrew/opt/llvm INSTA_UPDATE=always cargo test --manifest-path compiler/stage0/Cargo.toml && env LLVM_SYS_221_PREFIX=/opt/homebrew/opt/llvm cargo test --manifest-path compiler/stage0/Cargo.toml passed","suggested_next_fixture":"compiler/typ/tests/fixtures/corpus/0004_annotated_value_int.ml, translated with concrete RiotML integer type such as i64 rather than old `int`."}}
{"run":61,"commit":"28eb398","metric":61,"metrics":{"wall_s":25},"status":"keep","description":"feat(stage0): import typ 0004 annotated i64 fixture","timestamp":1779144435324,"segment":0,"confidence":4,"asi":{"hypothesis":"The old annotated int fixture can be translated to RiotML's concrete integer type `i64` and should compile with the existing annotation parser and integer constant support.","original_fixture":"compiler/typ/tests/fixtures/corpus/0004_annotated_value_int.ml","translated_fixture":"compiler/fixtures/programs/imported/typ/0004_annotated_value_int.ml","feature_added":"No new compiler feature; exercised existing optional local let annotation parsing with concrete `i64` instead of old `int`.","validation":"env LLVM_SYS_221_PREFIX=/opt/homebrew/opt/llvm INSTA_UPDATE=always cargo test --manifest-path compiler/stage0/Cargo.toml && env LLVM_SYS_221_PREFIX=/opt/homebrew/opt/llvm cargo test --manifest-path compiler/stage0/Cargo.toml passed","suggested_next_fixture":"compiler/typ/tests/fixtures/corpus/0007_annotated_value_string.ml"}}
{"run":62,"commit":"3fb98c1","metric":62,"metrics":{"wall_s":24.9},"status":"keep","description":"feat(stage0): import typ 0007 annotated string fixture","timestamp":1779144499396,"segment":0,"confidence":3.935483870967742,"asi":{"hypothesis":"After optional local let annotations landed, the annotated string typ fixture should compile without more compiler work and adds annotation coverage for string values.","original_fixture":"compiler/typ/tests/fixtures/corpus/0007_annotated_value_string.ml","translated_fixture":"compiler/fixtures/programs/imported/typ/0007_annotated_value_string.ml","feature_added":"No new compiler feature; exercised existing optional local let annotation parsing with `string`.","validation":"env LLVM_SYS_221_PREFIX=/opt/homebrew/opt/llvm INSTA_UPDATE=always cargo test --manifest-path compiler/stage0/Cargo.toml && env LLVM_SYS_221_PREFIX=/opt/homebrew/opt/llvm cargo test --manifest-path compiler/stage0/Cargo.toml passed","suggested_next_fixture":"compiler/typ/tests/fixtures/corpus/0002_annotated_value_char.ml"}}
{"type":"config","name":"Deduplicate imported RiotML fixture corpus","metricName":"redundant_fixture_groups","metricUnit":"","bestDirection":"lower"}
{"run":63,"commit":"ebe0075","metric":8,"metrics":{},"status":"keep","description":"chore(stage0): baseline imported fixture deduplication candidates","timestamp":1779144940365,"segment":1,"confidence":null,"asi":{"hypothesis":"Establish a deduplication baseline by counting groups of imported fixtures that appear to test identical language support or stale type spelling before removing redundant fixtures.","validation":"static redundant group count only; no source changes yet"}}
{"run":64,"commit":"5f7fc7b","metric":0,"metrics":{"imported_fixture_files":50,"wall_s":28.1},"status":"keep","description":"chore(stage0): deduplicate imported fixture corpus","timestamp":1779145006579,"segment":1,"confidence":null,"asi":{"hypothesis":"Removing imported fixtures that only vary literal values or duplicate the same parser/checker feature keeps the shared corpus focused while preserving one representative fixture per meaningful RiotML feature and provenance class.","dedup_removed":"Removed duplicate add_two_ints, redundant parenthesized bool, and typ const literal variants for bool/char/float/int/string that were already covered by syn simple literal fixtures or annotation/choose fixtures.","ebnf_consulted":"Checked compiler/riotml.ebnf expression/type sections; annotations are path type_exprs, modulo is %, exponents are compact e/E syntax, and concrete numeric types like i64/f64 are path-like type atoms.","additional_cleanup":"Updated imported typ annotated float fixture from old `float` spelling to RiotML-style `f64` per user guidance.","validation":"env LLVM_SYS_221_PREFIX=/opt/homebrew/opt/llvm INSTA_UPDATE=always cargo test --manifest-path compiler/stage0/Cargo.toml && env LLVM_SYS_221_PREFIX=/opt/homebrew/opt/llvm cargo test --manifest-path compiler/stage0/Cargo.toml passed","next_action_hint":"Continue future imports with concrete f16/f32/f64 and u*/i* annotations, and avoid adding value-only variants when an existing fixture already covers the feature."}}
{"type":"config","name":"Grow meaningful non-duplicated RiotML compiler fixtures","metricName":"imported_fixture_files","metricUnit":"","bestDirection":"higher"}
{"run":65,"commit":"e1c522e","metric":50,"metrics":{},"status":"keep","description":"chore(stage0): baseline meaningful imported fixture count after deduplication","timestamp":1779145487134,"segment":2,"confidence":null,"asi":{"hypothesis":"Measure the deduplicated imported fixture count before resuming growth toward the larger meaningful corpus target.","validation":"Static fixture count baseline only."}}
{"run":66,"commit":"4e5e4b1","metric":51,"metrics":{"wall_s":29},"status":"keep","description":"feat(stage0): import typ 0002 annotated char fixture","timestamp":1779145546089,"segment":2,"confidence":null,"asi":{"hypothesis":"The annotated char fixture adds meaningful coverage for local type annotations over char values without duplicating the unannotated char fixture, since it exercises both annotation parsing and char constants.","original_fixture":"compiler/typ/tests/fixtures/corpus/0002_annotated_value_char.ml","translated_fixture":"compiler/fixtures/programs/imported/typ/0002_annotated_value_char.ml","feature_added":"No new compiler feature; exercised existing optional local let annotation parsing with `char`.","validation":"env LLVM_SYS_221_PREFIX=/opt/homebrew/opt/llvm INSTA_UPDATE=always cargo test --manifest-path compiler/stage0/Cargo.toml && env LLVM_SYS_221_PREFIX=/opt/homebrew/opt/llvm cargo test --manifest-path compiler/stage0/Cargo.toml passed","next_action_hint":"Add a normalized Levenshtein similarity helper for future dedup screening before importing candidate fixtures."}}
{"run":67,"commit":"dffa0eb","metric":52,"metrics":{"wall_s":100},"status":"keep","description":"feat(stage0): import syn 0020 unit fixture","timestamp":1779145791629,"segment":2,"confidence":2,"asi":{"hypothesis":"Unit is a distinct literal in riotml.ebnf and is not a value-only duplicate of existing literal fixtures, so adding minimal unit constant parsing/checking/printing pushes parser and checker coverage meaningfully.","original_fixture":"compiler/syn/tests/fixtures/0020_unit.ml","translated_fixture":"compiler/fixtures/programs/imported/syn/0020_unit.ml","feature_added":"Parser/checker support for the RiotML unit literal `()`, with println rendering it as `()`.","dedup_similarity_check":"Whitespace-normalized Levenshtein showed low distance to simple literal fixtures, but this was accepted because the semantic feature is a new EBNF literal kind rather than a value-only variation.","ebnf_consulted":"compiler/riotml.ebnf defines unit_lit ::= `()` under literal.","validation":"env LLVM_SYS_221_PREFIX=/opt/homebrew/opt/llvm INSTA_UPDATE=always cargo test --manifest-path compiler/stage0/Cargo.toml && env LLVM_SYS_221_PREFIX=/opt/homebrew/opt/llvm cargo test --manifest-path compiler/stage0/Cargo.toml passed","suggested_next_fixture":"compiler/typ/tests/fixtures/corpus/0031_const_unit_value.ml only if it adds annotation/typ provenance; otherwise skip as value-only duplicate and move to tuples/lists."}}
{"run":68,"commit":"9a71295","metric":53,"metrics":{"wall_s":127.8},"status":"keep","description":"feat(stage0): import syn 0121 tuple-two fixture","timestamp":1779146028210,"segment":2,"confidence":3,"asi":{"hypothesis":"A two-item tuple is the smallest tuple slice in riotml.ebnf and meaningfully pushes parser/checker constant handling beyond scalar literals without implementing patterns or projection.","original_fixture":"compiler/syn/tests/fixtures/0121_tuple_two.ml","translated_fixture":"compiler/fixtures/programs/imported/syn/0121_tuple_two.ml","feature_added":"Parser/checker support for tuple expressions with two or more constant items; println renders tuple constants as parenthesized comma-separated values.","dedup_similarity_check":"Tuple syntax is structurally distinct from existing scalar literal fixtures after normalized comparison and covers a new EBNF primary expression class.","ebnf_consulted":"compiler/riotml.ebnf defines tuple_expr ::= `(` expr `,` expr_list? `)` and expr_list with optional trailing comma.","validation":"env LLVM_SYS_221_PREFIX=/opt/homebrew/opt/llvm INSTA_UPDATE=always cargo test --manifest-path compiler/stage0/Cargo.toml && env LLVM_SYS_221_PREFIX=/opt/homebrew/opt/llvm cargo test --manifest-path compiler/stage0/Cargo.toml passed","suggested_next_fixture":"compiler/syn/tests/fixtures/0122_tuple_three.ml"}}
{"run":69,"commit":"0a85308","metric":54,"metrics":{"wall_s":22.6},"status":"keep","description":"feat(stage0): import syn 0123 mixed tuple fixture","timestamp":1779146108257,"segment":2,"confidence":4,"asi":{"hypothesis":"The tuple-three fixture is too close to tuple-two under normalized Levenshtein, but a mixed-type tuple meaningfully exercises tuple constants containing heterogeneous scalar values without new compiler support.","original_fixture":"compiler/syn/tests/fixtures/0123_tuple_mixed_types.ml","translated_fixture":"compiler/fixtures/programs/imported/syn/0123_tuple_mixed_types.ml","feature_added":"No new compiler feature; exercised existing tuple constant support with int, string, and bool elements.","dedup_similarity_check":"Skipped syn/0122_tuple_three because normalized Levenshtein distance to existing syn/0121_tuple_two was 2 and it only adds another integer element; selected syn/0123 with nearest tuple distance 12.","ebnf_consulted":"compiler/riotml.ebnf tuple_expr permits expr_list, so heterogeneous tuple expressions are syntactically valid.","validation":"env LLVM_SYS_221_PREFIX=/opt/homebrew/opt/llvm INSTA_UPDATE=always cargo test --manifest-path compiler/stage0/Cargo.toml && env LLVM_SYS_221_PREFIX=/opt/homebrew/opt/llvm cargo test --manifest-path compiler/stage0/Cargo.toml passed","suggested_next_fixture":"compiler/syn/tests/fixtures/0124_tuple_nested.ml"}}
