{"run":70,"commit":"c61f1e4","metric":55,"metrics":{"wall_s":23.3},"status":"keep","description":"feat(stage0): import syn 0124 nested tuple fixture","timestamp":1779146187409,"segment":2,"confidence":3.3333333333333335,"asi":{"hypothesis":"Nested tuple constants meaningfully extend tuple coverage by exercising recursive tuple parsing and recursive constant rendering, unlike tuple-three which was value-only similar to tuple-two.","original_fixture":"compiler/syn/tests/fixtures/0124_tuple_nested.ml","translated_fixture":"compiler/fixtures/programs/imported/syn/0124_tuple_nested.ml","feature_added":"No new compiler feature; exercised existing tuple support recursively with tuple elements inside a tuple.","dedup_similarity_check":"Whitespace-normalized nearest distance was 5 to nested comparison and 8 to tuple-two; accepted because this covers recursive tuple structure rather than another flat tuple arity/value variant.","ebnf_consulted":"compiler/riotml.ebnf tuple_expr permits expr items, so nested tuple expressions are valid tuple elements.","validation":"env LLVM_SYS_221_PREFIX=/opt/homebrew/opt/llvm INSTA_UPDATE=always cargo test --manifest-path compiler/stage0/Cargo.toml && env LLVM_SYS_221_PREFIX=/opt/homebrew/opt/llvm cargo test --manifest-path compiler/stage0/Cargo.toml passed","suggested_next_fixture":"compiler/syn/tests/fixtures/0125_tuple_with_expr.ml, if accepted as tuple+arithmetic composition rather than duplicate arithmetic coverage."}}
{"run":71,"commit":"b7533ec","metric":56,"metrics":{"wall_s":23},"status":"keep","description":"feat(stage0): import syn 0125 tuple-with-expr fixture","timestamp":1779146266879,"segment":2,"confidence":3,"asi":{"hypothesis":"Tuple elements can be arbitrary expressions per riotml.ebnf, so a tuple containing arithmetic expressions meaningfully exercises composition of tuple constant evaluation with existing arithmetic constant folding.","original_fixture":"compiler/syn/tests/fixtures/0125_tuple_with_expr.ml","translated_fixture":"compiler/fixtures/programs/imported/syn/0125_tuple_with_expr.ml","feature_added":"No new compiler feature; exercised tuple constant evaluation with arithmetic expression elements.","dedup_similarity_check":"Whitespace-normalized nearest distance was 4 to arithmetic-heavy fixtures, but accepted because it specifically covers arithmetic expressions as tuple elements rather than standalone arithmetic.","ebnf_consulted":"compiler/riotml.ebnf tuple_expr uses expr and expr_list, permitting arithmetic expressions in tuple positions.","validation":"env LLVM_SYS_221_PREFIX=/opt/homebrew/opt/llvm INSTA_UPDATE=always cargo test --manifest-path compiler/stage0/Cargo.toml && env LLVM_SYS_221_PREFIX=/opt/homebrew/opt/llvm cargo test --manifest-path compiler/stage0/Cargo.toml passed","suggested_next_fixture":"compiler/syn/tests/fixtures/0126_tuple_with_ident.ml"}}
{"run":72,"commit":"ecdf13c","metric":57,"metrics":{"wall_s":30.5},"status":"keep","description":"feat(stage0): import syn 0126 tuple-with-ident fixture","timestamp":1779146364654,"segment":2,"confidence":3.5,"asi":{"hypothesis":"Tuple elements can be arbitrary expressions per riotml.ebnf, and tuple elements that are local paths meaningfully exercise composition of tuple constant evaluation with binding lookup rather than only literals/arithmetic.","original_fixture":"compiler/syn/tests/fixtures/0126_tuple_with_ident.ml","translated_fixture":"compiler/fixtures/programs/imported/syn/0126_tuple_with_ident.ml","feature_added":"No new compiler feature; exercised existing tuple constant evaluation with local path elements resolved from prior bindings.","dedup_similarity_check":"Whitespace-normalized nearest distance was 23 to multiple lets, much farther than recent tuple value-only candidates, so this is structurally distinct enough to keep.","ebnf_consulted":"compiler/riotml.ebnf tuple_expr uses expr and expr_list, permitting path expressions in tuple positions.","validation":"env LLVM_SYS_221_PREFIX=/opt/homebrew/opt/llvm INSTA_UPDATE=always cargo test --manifest-path compiler/stage0/Cargo.toml && env LLVM_SYS_221_PREFIX=/opt/homebrew/opt/llvm cargo test --manifest-path compiler/stage0/Cargo.toml passed","suggested_next_fixture":"compiler/syn/tests/fixtures/0128_tuple_unit.ml"}}
{"run":73,"commit":"f466d71","metric":58,"metrics":{"wall_s":24.1},"status":"keep","description":"feat(stage0): import syn 0128 tuple-unit fixture","timestamp":1779146446698,"segment":2,"confidence":4,"asi":{"hypothesis":"A tuple whose elements are unit literals meaningfully exercises composition of two distinct EBNF literal/expression features: tuple_expr elements and unit_lit rendering.","original_fixture":"compiler/syn/tests/fixtures/0128_tuple_unit.ml","translated_fixture":"compiler/fixtures/programs/imported/syn/0128_tuple_unit.ml","feature_added":"No new compiler feature; exercised existing tuple constant rendering with unit literal elements.","dedup_similarity_check":"Whitespace-normalized nearest distance was 4 to tuple_two and 5 to unit; accepted because it combines tuple rendering with unit elements, while skipped 0129_tuple_four as a flat arity-only variation close to existing tuple fixtures.","ebnf_consulted":"compiler/riotml.ebnf defines tuple_expr items as expr and unit_lit as `()`, so `((), ())` is valid RiotML syntax.","validation":"env LLVM_SYS_221_PREFIX=/opt/homebrew/opt/llvm INSTA_UPDATE=always cargo test --manifest-path compiler/stage0/Cargo.toml && env LLVM_SYS_221_PREFIX=/opt/homebrew/opt/llvm cargo test --manifest-path compiler/stage0/Cargo.toml passed","suggested_next_fixture":"compiler/syn/tests/fixtures/0131_list_empty.ml"}}
{"run":74,"commit":"c912a48","metric":59,"metrics":{"wall_s":32.4},"status":"keep","description":"feat(stage0): import syn 0131 empty list fixture","timestamp":1779147202234,"segment":2,"confidence":3.6,"asi":{"hypothesis":"After the logos/recursive descent parser migration, the empty-list fixture is the smallest list_expr slice in riotml.ebnf and pushes lexer, parser, checker, and constant rendering without overgeneralizing list semantics.","original_fixture":"compiler/syn/tests/fixtures/0131_list_empty.ml","translated_fixture":"compiler/fixtures/programs/imported/syn/0131_list_empty.ml","feature_added":"Added `[`/`]` tokens to the logos lexer plus recursive-descent parsing/checking/rendering for list constants, starting with empty lists.","dedup_similarity_check":"Empty list is structurally close to scalar literal fixtures after whitespace normalization, but it introduces a new EBNF collection expression class and lexer tokens, so it is meaningful.","ebnf_consulted":"compiler/riotml.ebnf defines list_expr ::= `[` list_expr_items? `]`.","validation":"env LLVM_SYS_221_PREFIX=/opt/homebrew/opt/llvm INSTA_UPDATE=always cargo test --manifest-path compiler/stage0/Cargo.toml && env LLVM_SYS_221_PREFIX=/opt/homebrew/opt/llvm cargo test --manifest-path compiler/stage0/Cargo.toml passed","suggested_next_fixture":"compiler/syn/tests/fixtures/0132_list_one.ml"}}
{"run":75,"commit":"98d0af1","metric":60,"metrics":{"wall_s":24.2},"status":"keep","description":"feat(stage0): import syn 0132 one-item list fixture","timestamp":1779147290568,"segment":2,"confidence":3.3333333333333335,"asi":{"hypothesis":"A one-item list is the smallest non-empty list slice after empty list support and meaningfully exercises list item parsing/rendering under riotml.ebnf without adding broad list semantics.","original_fixture":"compiler/syn/tests/fixtures/0132_list_one.ml","translated_fixture":"compiler/fixtures/programs/imported/syn/0132_list_one.ml","feature_added":"No new compiler feature; exercised existing list expression support with one constant element.","dedup_similarity_check":"Whitespace-normalized distance to empty list was 1, but accepted because empty and non-empty list parsing take different parser branches and this validates list item rendering.","ebnf_consulted":"compiler/riotml.ebnf defines list_expr_items as comma-separated list_expr_item; old fixture `[ 1 ]` translates directly to RiotML `[1]`.","validation":"env LLVM_SYS_221_PREFIX=/opt/homebrew/opt/llvm INSTA_UPDATE=always cargo test --manifest-path compiler/stage0/Cargo.toml && env LLVM_SYS_221_PREFIX=/opt/homebrew/opt/llvm cargo test --manifest-path compiler/stage0/Cargo.toml passed","suggested_next_fixture":"compiler/syn/tests/fixtures/0133_list_three.ml translated with RiotML comma separators, unless skipped as arity-only after one representative multi-element list."}}
{"run":76,"commit":"b3a45b8","metric":61,"metrics":{"wall_s":24.7},"status":"keep","description":"feat(stage0): import syn 0133 multi-item list fixture","timestamp":1779147392930,"segment":2,"confidence":3.6666666666666665,"asi":{"hypothesis":"A multi-item list is meaningfully distinct from empty and one-item list fixtures because it exercises the recursive-descent list item loop and comma-separated RiotML list syntax from the EBNF.","original_fixture":"compiler/syn/tests/fixtures/0133_list_three.ml","translated_fixture":"compiler/fixtures/programs/imported/syn/0133_list_three.ml","feature_added":"No new compiler feature; exercised existing list parsing/rendering with multiple constant elements and RiotML comma separators.","dedup_similarity_check":"Whitespace-normalized nearest distance was 4 to one-item list and tuple-two; accepted because it validates the repeated list item branch, but future integer-only arity variations should be skipped.","ebnf_consulted":"compiler/riotml.ebnf defines list_expr_items as comma-separated list_expr_item; old OCaml semicolon separators were translated to RiotML commas.","validation":"env LLVM_SYS_221_PREFIX=/opt/homebrew/opt/llvm INSTA_UPDATE=always cargo test --manifest-path compiler/stage0/Cargo.toml && env LLVM_SYS_221_PREFIX=/opt/homebrew/opt/llvm cargo test --manifest-path compiler/stage0/Cargo.toml passed","suggested_next_fixture":"compiler/syn/tests/fixtures/0134_list_strings.ml if kept for heterogeneous literal-kind list rendering, otherwise skip to nested/mixed expression lists."}}
{"run":77,"commit":"816327d","metric":62,"metrics":{"wall_s":24.7},"status":"keep","description":"feat(stage0): import syn 0135 nested list fixture","timestamp":1779147480478,"segment":2,"confidence":4,"asi":{"hypothesis":"Nested lists meaningfully extend list coverage by exercising recursive list expression parsing and recursive constant rendering, unlike string or arithmetic list variants that are closer to existing scalar/list composition fixtures.","original_fixture":"compiler/syn/tests/fixtures/0135_list_nested.ml","translated_fixture":"compiler/fixtures/programs/imported/syn/0135_list_nested.ml","feature_added":"No new compiler feature; exercised existing list expression support recursively with list elements inside a list.","dedup_similarity_check":"Whitespace-normalized nearest distances were 6 to nested tuple and multi-item list; accepted because this covers recursive list structure. Skipped list_with_expr for now because distance to tuple_with_expr was 2 and it mostly repeats expression-element coverage.","ebnf_consulted":"compiler/riotml.ebnf list_expr_item permits any expr, so nested list expressions are valid list items; old semicolon separators were translated to RiotML commas.","validation":"env LLVM_SYS_221_PREFIX=/opt/homebrew/opt/llvm INSTA_UPDATE=always cargo test --manifest-path compiler/stage0/Cargo.toml && env LLVM_SYS_221_PREFIX=/opt/homebrew/opt/llvm cargo test --manifest-path compiler/stage0/Cargo.toml passed","suggested_next_fixture":"compiler/syn/tests/fixtures/0134_list_strings.ml if retained for non-int list element rendering, otherwise move to list_with_ident or call expressions."}}
{"run":78,"commit":"209749d","metric":63,"metrics":{"wall_s":33.2},"status":"keep","description":"feat(stage0): import syn 0134 string list fixture","timestamp":1779147584301,"segment":2,"confidence":3.7142857142857144,"asi":{"hypothesis":"A string list is a more meaningful next list fixture than list_with_ident because normalized similarity shows list_with_ident is nearly identical to tuple_with_ident, while string lists exercise list rendering over non-integer scalar elements.","original_fixture":"compiler/syn/tests/fixtures/0134_list_strings.ml","translated_fixture":"compiler/fixtures/programs/imported/syn/0134_list_strings.ml","feature_added":"No new compiler feature; exercised existing list expression support with multiple string literal elements.","dedup_similarity_check":"Whitespace-normalized nearest distance for list_strings was 8, while list_with_ident was distance 2 from tuple_with_ident; selected list_strings to avoid a near-duplicate shape.","ebnf_consulted":"compiler/riotml.ebnf list_expr_item permits any expr; old OCaml semicolon separators were translated to RiotML commas.","validation":"env LLVM_SYS_221_PREFIX=/opt/homebrew/opt/llvm INSTA_UPDATE=always cargo test --manifest-path compiler/stage0/Cargo.toml && env LLVM_SYS_221_PREFIX=/opt/homebrew/opt/llvm cargo test --manifest-path compiler/stage0/Cargo.toml passed","suggested_next_fixture":"Skip compiler/syn/tests/fixtures/0139_list_with_ident.ml as too similar to tuple_with_ident; consider compiler/syn/tests/fixtures/0140_list_with_call.ml only after real function/call return support exists, or move to sequence/block fixtures."}}
{"run":79,"commit":"feat-st","metric":0,"metrics":{"wall_s":0.8},"status":"crash","description":"feat(stage0): try dbg call support for typ tuple fixture","timestamp":1779147671561,"segment":2,"confidence":3.7142857142857144,"asi":{"hypothesis":"Adding dbg as an alias for constant-value output should support debug-style fixture rendering for non-string values.","original_fixture":"compiler/typ/tests/fixtures/corpus/0029_const_tuple_int_bool.ml","translated_fixture":"compiler/fixtures/programs/imported/typ/0029_const_tuple_int_bool.ml","error":"Rust pattern matched &[String] with &str literals in callee.segments.as_slice().","rollback_reason":"Compile failed before tests due to type mismatch in slice pattern.","next_action_hint":"Reapply dbg support using `callee.segments.len() == 1 && matches!(callee.segments[0].as_str(), \"println\" | \"dbg\")` or equivalent."}}
{"run":80,"commit":"feat-st","metric":0,"metrics":{"wall_s":0.6},"status":"crash","description":"feat(stage0): retry dbg call support for typ tuple fixture","timestamp":1779147715143,"segment":2,"confidence":3.7142857142857144,"asi":{"hypothesis":"Fixing the dbg callee-name check should allow dbg fixtures to compile after the parser migration.","error":"Build failed because codegen match is non-exhaustive for existing RirInstruction::RuntimeDbg variant introduced in unrelated parser/runtime work.","rollback_reason":"Compile failed before tests due to missing codegen arm for RuntimeDbg.","next_action_hint":"Inspect ir.rs/codegen.rs and either lower dbg to existing RuntimePrintln or add RuntimeDbg handling in codegen equivalent to println."}}
{"run":81,"commit":"d7aaf3b","metric":64,"metrics":{"wall_s":38.5},"status":"keep","description":"feat(stage0): add dbg output and import typ tuple fixture","timestamp":1779147939227,"segment":2,"confidence":3.5,"asi":{"hypothesis":"Non-string value fixtures should use debug-style output rather than println; adding a first dbg-based imported fixture validates the typed IR/runtime dbg path while growing tuple corpus coverage.","original_fixture":"compiler/typ/tests/fixtures/corpus/0029_const_tuple_int_bool.ml","translated_fixture":"compiler/fixtures/programs/imported/typ/0029_const_tuple_int_bool.ml","feature_added":"Added typed/RIR dbg output support wired to the existing runtime dbg hook, and validated a dbg-based tuple fixture. Existing non-string imported fixtures were migrated in the worktree to use dbg as debug representation output.","dedup_similarity_check":"Tuple int/bool has overlap with existing tuple fixtures, but it is kept because it is the first dbg-based imported fixture and covers typ corpus tuple provenance after deduplication.","ebnf_consulted":"compiler/riotml.ebnf call_suffix permits path calls like dbg(value), and tuple_expr permits the tuple value.","validation":"env LLVM_SYS_221_PREFIX=/opt/homebrew/opt/llvm INSTA_UPDATE=always cargo test --manifest-path compiler/stage0/Cargo.toml && env LLVM_SYS_221_PREFIX=/opt/homebrew/opt/llvm cargo test --manifest-path compiler/stage0/Cargo.toml passed","note":"A prior failed run exposed a String/&str pattern mismatch and then a missing RIR dbg variant; fixed by matching callee segment with as_str and adding TypedExpr/RirInstruction dbg lowering."}}
{"run":82,"commit":"86c899d","metric":65,"metrics":{"wall_s":25.6},"status":"keep","description":"feat(stage0): import typ 0013 choose tuple fixture","timestamp":1779148047562,"segment":2,"confidence":3.75,"asi":{"hypothesis":"The tuple choose fixture is a meaningful next typ corpus import because it composes existing if-selection with tuple constants, extending the choose family beyond scalar values without new broad compiler support.","original_fixture":"compiler/typ/tests/fixtures/corpus/0013_choose_tuple.ml","translated_fixture":"compiler/fixtures/programs/imported/typ/0013_choose_tuple.ml","feature_added":"No new compiler feature; exercised existing dbg output, tuple constants, local bindings, and if selection together.","dedup_similarity_check":"Whitespace-normalized nearest distance was 8 to choose_bool, but kept because this is the tuple member of the choose family and exercises aggregate value selection; annotated tuple was skipped for now as closer to const tuple/annotation variants.","ebnf_consulted":"compiler/riotml.ebnf permits path calls through call_suffix, if_expr with blocks, and tuple_expr values.","validation":"env LLVM_SYS_221_PREFIX=/opt/homebrew/opt/llvm INSTA_UPDATE=always cargo test --manifest-path compiler/stage0/Cargo.toml && env LLVM_SYS_221_PREFIX=/opt/homebrew/opt/llvm cargo test --manifest-path compiler/stage0/Cargo.toml passed","user_worktree_note":"User is also editing this codebase; preserve unrelated dirty changes and do not revert/reset/stash user work. In this iteration, existing dirty parser help-text changes were left intact and included by normal logging if still present."}}
{"run":83,"commit":"7b3f43a","metric":66,"metrics":{"wall_s":25.6},"status":"keep","description":"feat(stage0): import syn 0157 list of tuples fixture","timestamp":1779148168456,"segment":2,"confidence":4,"asi":{"hypothesis":"A list containing tuple elements is a meaningful next aggregate-composition fixture: it exercises recursive rendering across list and tuple boundaries and is less duplicate-like than tuple of lists under normalized Levenshtein.","original_fixture":"compiler/syn/tests/fixtures/0157_nested_tuple_list.ml","translated_fixture":"compiler/fixtures/programs/imported/syn/0157_nested_tuple_list.ml","feature_added":"No new compiler feature; exercised existing dbg output plus list and tuple constant support together.","dedup_similarity_check":"Whitespace-normalized nearest distance was 7 to nested tuple and 10 to nested list, while tuple-of-lists candidate was distance 2 to nested_list; selected list-of-tuples as more distinct.","ebnf_consulted":"compiler/riotml.ebnf list_expr_item permits any expr and tuple_expr is an expr, so list items may be tuples; old semicolon separators translated to RiotML commas.","validation":"env LLVM_SYS_221_PREFIX=/opt/homebrew/opt/llvm INSTA_UPDATE=always cargo test --manifest-path compiler/stage0/Cargo.toml && env LLVM_SYS_221_PREFIX=/opt/homebrew/opt/llvm cargo test --manifest-path compiler/stage0/Cargo.toml passed","user_worktree_note":"Preserved unrelated user changes; only added the new imported fixture and sidecar in this iteration.","suggested_next_fixture":"Consider a small record fixture or named-field syntax from riotml.ebnf if present in old corpus, otherwise add a non-duplicate list/tuple composition with paths or conditionals."}}
{"run":84,"commit":"366a9e9","metric":67,"metrics":{"wall_s":25.7},"status":"keep","description":"feat(stage0): import syn 0202 one-field record fixture","timestamp":1779148364689,"segment":2,"confidence":3.7777777777777777,"asi":{"hypothesis":"A one-field record is the smallest record_expr slice in riotml.ebnf and meaningfully pushes the logos/recursive-descent parser and constant debug rendering into record syntax.","original_fixture":"compiler/syn/tests/fixtures/0202_record_one_field.ml","translated_fixture":"compiler/fixtures/programs/imported/syn/0202_record_one_field.ml","feature_added":"Parser/checker support for uppercase-path record expressions with constant fields, rendered through dbg as `Path { field: value }`. The uppercase restriction keeps the narrow parser from confusing lowercase if conditions followed by blocks with record literals.","dedup_similarity_check":"Whitespace-normalized nearest distance to existing fixtures was 9, and record syntax is a new EBNF expression class, so this is not a value-only duplicate.","ebnf_consulted":"compiler/riotml.ebnf defines record_expr as path `{` record_expr_fields? `}` and record fields as `lower_ident : expr`; old OCaml `{ x = 1 }` was translated to RiotML `Point { x: 1 }`.","validation":"env LLVM_SYS_221_PREFIX=/opt/homebrew/opt/llvm INSTA_UPDATE=always cargo test --manifest-path compiler/stage0/Cargo.toml && env LLVM_SYS_221_PREFIX=/opt/homebrew/opt/llvm cargo test --manifest-path compiler/stage0/Cargo.toml passed","next_action_hint":"Next record fixture can add multiple fields (`0203_record_two_fields`) if not too similar, or a record embedded in tuple/list to exercise aggregate composition."}}
