{"run":26,"commit":"9424b79","metric":26,"metrics":{"wall_s":25.6},"status":"keep","description":"Imported syn 0049 comparison chain fixture with narrow constant && support","timestamp":1779141247417,"segment":0,"confidence":3.8461538461538463,"asi":{"hypothesis":"A bool-only constant && parser/checker case can compose existing less-than comparisons for the old comparison-chain fixture.","original_fixture":"compiler/syn/tests/fixtures/0049_comparison_chain.ml","translated_fixture":"compiler/fixtures/programs/imported/syn/0049_comparison_chain.ml","feature_added":"Parser/checker support for && over constant booleans; comparisons are explicitly parenthesized in RiotML translation.","validation":"env LLVM_SYS_221_PREFIX=/opt/homebrew/opt/llvm cargo test --manifest-path compiler/stage0/Cargo.toml passed","suggested_next_fixture":"compiler/syn/tests/fixtures/0053_and_chain.ml"}}
{"run":27,"commit":"f56d45b","metric":27,"metrics":{"wall_s":9.5},"status":"keep","description":"Imported syn 0053 boolean and-chain fixture using explicit grouping","timestamp":1779141288629,"segment":0,"confidence":3.7142857142857144,"asi":{"hypothesis":"The and-chain fixture can be translated as explicitly grouped RiotML boolean conjunctions and reuse constant && support.","original_fixture":"compiler/syn/tests/fixtures/0053_and_chain.ml","translated_fixture":"compiler/fixtures/programs/imported/syn/0053_and_chain.ml","feature_added":"No new compiler feature; exercised nested grouped && over constant booleans.","validation":"env LLVM_SYS_221_PREFIX=/opt/homebrew/opt/llvm cargo test --manifest-path compiler/stage0/Cargo.toml passed","suggested_next_fixture":"compiler/syn/tests/fixtures/0054_or_chain.ml"}}
{"run":28,"commit":"5325a49","metric":28,"metrics":{"wall_s":30.8},"status":"keep","description":"Imported syn 0054 boolean or-chain fixture with narrow constant || support","timestamp":1779141381746,"segment":0,"confidence":3.857142857142857,"asi":{"hypothesis":"A bool-only constant || parser/checker case can cover the old or-chain fixture when translated with explicit grouping.","original_fixture":"compiler/syn/tests/fixtures/0054_or_chain.ml","translated_fixture":"compiler/fixtures/programs/imported/syn/0054_or_chain.ml","feature_added":"Parser/checker support for || over constant booleans; chain translated with explicit grouping.","validation":"env LLVM_SYS_221_PREFIX=/opt/homebrew/opt/llvm cargo test --manifest-path compiler/stage0/Cargo.toml passed","suggested_next_fixture":"compiler/syn/tests/fixtures/0055_mixed_logic.ml"}}
{"run":29,"commit":"d882815","metric":29,"metrics":{"wall_s":10.5},"status":"keep","description":"Imported syn 0055 mixed logic fixture using existing grouped && and || support","timestamp":1779141422602,"segment":0,"confidence":4,"asi":{"hypothesis":"The mixed boolean logic fixture should compile without new support after && and || constants exist, provided the translation keeps explicit grouping.","original_fixture":"compiler/syn/tests/fixtures/0055_mixed_logic.ml","translated_fixture":"compiler/fixtures/programs/imported/syn/0055_mixed_logic.ml","feature_added":"No new compiler feature; exercised grouped && as the left operand of ||.","validation":"env LLVM_SYS_221_PREFIX=/opt/homebrew/opt/llvm cargo test --manifest-path compiler/stage0/Cargo.toml passed","suggested_next_fixture":"compiler/syn/tests/fixtures/0058_not.ml"}}
{"run":30,"commit":"9ebb3d6","metric":30,"metrics":{"wall_s":31.5},"status":"keep","description":"Imported syn 0058 logical not fixture with narrow constant ! support","timestamp":1779141493788,"segment":0,"confidence":3.8666666666666667,"asi":{"hypothesis":"RiotML uses ! for logical not, and a bool-only constant unary checker case can compile the old not fixture.","original_fixture":"compiler/syn/tests/fixtures/0058_not.ml","translated_fixture":"compiler/fixtures/programs/imported/syn/0058_not.ml","feature_added":"Parser/checker support for ! over constant booleans, returning a printable bool constant.","validation":"env LLVM_SYS_221_PREFIX=/opt/homebrew/opt/llvm cargo test --manifest-path compiler/stage0/Cargo.toml passed","suggested_next_fixture":"compiler/syn/tests/fixtures/0059_neg_expr.ml"}}
{"run":31,"commit":"0ac6a32","metric":31,"metrics":{"wall_s":10.4},"status":"keep","description":"Imported syn 0059 negated expression fixture using existing unary negation support","timestamp":1779141526410,"segment":0,"confidence":3.75,"asi":{"hypothesis":"The existing unary negation support should handle a parenthesized addition operand and grow coverage without compiler changes.","original_fixture":"compiler/syn/tests/fixtures/0059_neg_expr.ml","translated_fixture":"compiler/fixtures/programs/imported/syn/0059_neg_expr.ml","feature_added":"No new compiler feature; exercised unary - over a grouped constant addition expression.","validation":"env LLVM_SYS_221_PREFIX=/opt/homebrew/opt/llvm cargo test --manifest-path compiler/stage0/Cargo.toml passed","suggested_next_fixture":"compiler/syn/tests/fixtures/0060_not_comparison.ml"}}
{"run":32,"commit":"8a36c27","metric":32,"metrics":{"wall_s":10.8},"status":"keep","description":"Imported syn 0060 not-comparison fixture using existing ! and == support","timestamp":1779141565341,"segment":0,"confidence":3.875,"asi":{"hypothesis":"The not-comparison fixture can translate to RiotML !(1 == 2) and compile with existing constant equality and not support.","original_fixture":"compiler/syn/tests/fixtures/0060_not_comparison.ml","translated_fixture":"compiler/fixtures/programs/imported/syn/0060_not_comparison.ml","feature_added":"No new compiler feature; exercised unary ! over a grouped constant equality expression.","validation":"env LLVM_SYS_221_PREFIX=/opt/homebrew/opt/llvm cargo test --manifest-path compiler/stage0/Cargo.toml passed","suggested_next_fixture":"compiler/syn/tests/fixtures/0071_if_then_else_simple.ml"}}
{"run":33,"commit":"1b36923","metric":33,"metrics":{"wall_s":11},"status":"keep","description":"Imported typ 0015 const bool true fixture using existing literal println support","timestamp":1779141608721,"segment":0,"confidence":4,"asi":{"hypothesis":"A simple typ corpus constant-true fixture can be represented as a RiotML main that binds and prints the value, requiring no compiler changes.","original_fixture":"compiler/typ/tests/fixtures/corpus/0015_const_bool_true.ml","translated_fixture":"compiler/fixtures/programs/imported/typ/0015_const_bool_true.ml","feature_added":"No new compiler feature; began importing typ corpus constants with bool true coverage.","validation":"env LLVM_SYS_221_PREFIX=/opt/homebrew/opt/llvm cargo test --manifest-path compiler/stage0/Cargo.toml passed","suggested_next_fixture":"compiler/typ/tests/fixtures/corpus/0014_const_bool_false.ml"}}
{"run":34,"commit":"d6fdf0c","metric":34,"metrics":{"wall_s":10.9},"status":"keep","description":"Imported typ 0014 const bool false fixture using existing literal println support","timestamp":1779141641544,"segment":0,"confidence":3.8823529411764706,"asi":{"hypothesis":"The typ corpus constant-false fixture should compile with the existing bool literal and println support.","original_fixture":"compiler/typ/tests/fixtures/corpus/0014_const_bool_false.ml","translated_fixture":"compiler/fixtures/programs/imported/typ/0014_const_bool_false.ml","feature_added":"No new compiler feature; covered typ corpus bool false constant.","validation":"env LLVM_SYS_221_PREFIX=/opt/homebrew/opt/llvm cargo test --manifest-path compiler/stage0/Cargo.toml passed","suggested_next_fixture":"compiler/typ/tests/fixtures/corpus/0020_const_int_one.ml"}}
{"run":35,"commit":"49bb46e","metric":35,"metrics":{"wall_s":13.4},"status":"keep","description":"Imported typ 0020 const int one fixture using existing integer println support","timestamp":1779141683695,"segment":0,"confidence":3.7777777777777777,"asi":{"hypothesis":"The typ corpus constant integer one fixture maps directly to a RiotML value binding and println using existing integer literal support.","original_fixture":"compiler/typ/tests/fixtures/corpus/0020_const_int_one.ml","translated_fixture":"compiler/fixtures/programs/imported/typ/0020_const_int_one.ml","feature_added":"No new compiler feature; covered typ corpus integer one constant.","validation":"env LLVM_SYS_221_PREFIX=/opt/homebrew/opt/llvm cargo test --manifest-path compiler/stage0/Cargo.toml passed","suggested_next_fixture":"compiler/typ/tests/fixtures/corpus/0021_const_int_zero.ml"}}
{"run":36,"commit":"d3beb9d","metric":36,"metrics":{"wall_s":11.2},"status":"keep","description":"Imported typ 0021 const int zero fixture using existing integer println support","timestamp":1779141708759,"segment":0,"confidence":3.888888888888889,"asi":{"hypothesis":"The typ corpus constant zero fixture should compile through existing integer literal and println support.","original_fixture":"compiler/typ/tests/fixtures/corpus/0021_const_int_zero.ml","translated_fixture":"compiler/fixtures/programs/imported/typ/0021_const_int_zero.ml","feature_added":"No new compiler feature; covered typ corpus integer zero constant.","validation":"env LLVM_SYS_221_PREFIX=/opt/homebrew/opt/llvm cargo test --manifest-path compiler/stage0/Cargo.toml passed","suggested_next_fixture":"compiler/typ/tests/fixtures/corpus/0028_const_string_word.ml"}}
{"run":37,"commit":"d766dc9","metric":37,"metrics":{"wall_s":12.7},"status":"keep","description":"Imported typ 0028 const string word fixture using existing string println support","timestamp":1779141736899,"segment":0,"confidence":4,"asi":{"hypothesis":"The typ corpus word string constant maps directly to a RiotML local string binding and deterministic println output.","original_fixture":"compiler/typ/tests/fixtures/corpus/0028_const_string_word.ml","translated_fixture":"compiler/fixtures/programs/imported/typ/0028_const_string_word.ml","feature_added":"No new compiler feature; covered typ corpus non-empty string constant.","validation":"env LLVM_SYS_221_PREFIX=/opt/homebrew/opt/llvm cargo test --manifest-path compiler/stage0/Cargo.toml passed","suggested_next_fixture":"compiler/typ/tests/fixtures/corpus/0027_const_string_empty.ml"}}
{"run":38,"commit":"cdc7566","metric":38,"metrics":{"wall_s":11.3},"status":"keep","description":"Imported typ 0027 const empty string fixture using existing string println support","timestamp":1779141764356,"segment":0,"confidence":3.8947368421052633,"asi":{"hypothesis":"The typ corpus empty string constant fixture should compile through existing empty string and println handling.","original_fixture":"compiler/typ/tests/fixtures/corpus/0027_const_string_empty.ml","translated_fixture":"compiler/fixtures/programs/imported/typ/0027_const_string_empty.ml","feature_added":"No new compiler feature; covered typ corpus empty string constant with blank-line stdout.","validation":"env LLVM_SYS_221_PREFIX=/opt/homebrew/opt/llvm cargo test --manifest-path compiler/stage0/Cargo.toml passed","suggested_next_fixture":"compiler/syn/tests/fixtures/0071_if_then_else_simple.ml"}}
{"run":39,"commit":"51de7b1","metric":39,"metrics":{"wall_s":52.1},"status":"keep","description":"Imported syn 0071 if-then-else fixture with narrow constant if expression support","timestamp":1779141869216,"segment":0,"confidence":3.8,"asi":{"hypothesis":"A minimal RiotML if expression with braced expression branches and constant bool condition can cover the simplest old if fixture without general block support.","original_fixture":"compiler/syn/tests/fixtures/0071_if_then_else_simple.ml","translated_fixture":"compiler/fixtures/programs/imported/syn/0071_if_then_else_simple.ml","feature_added":"Parser/checker support for `if <expr> { <expr> } else { <expr> }` as a constant expression selected by a bool condition.","validation":"env LLVM_SYS_221_PREFIX=/opt/homebrew/opt/llvm cargo test --manifest-path compiler/stage0/Cargo.toml passed","suggested_next_fixture":"compiler/syn/tests/fixtures/0072_if_condition_expr.ml"}}
{"run":40,"commit":"d948379","metric":40,"metrics":{"wall_s":11.7},"status":"keep","description":"Imported syn 0072 if condition expression fixture using existing < and if support","timestamp":1779141903311,"segment":0,"confidence":3.9,"asi":{"hypothesis":"The if-condition fixture should compile with existing constant less-than condition evaluation and string branch selection.","original_fixture":"compiler/syn/tests/fixtures/0072_if_condition_expr.ml","translated_fixture":"compiler/fixtures/programs/imported/syn/0072_if_condition_expr.ml","feature_added":"No new compiler feature; exercised if with a constant comparison condition and string branches.","validation":"env LLVM_SYS_221_PREFIX=/opt/homebrew/opt/llvm cargo test --manifest-path compiler/stage0/Cargo.toml passed","suggested_next_fixture":"compiler/syn/tests/fixtures/0073_if_nested.ml"}}
{"run":41,"commit":"d80b80f","metric":41,"metrics":{"wall_s":12.8},"status":"keep","description":"Imported syn 0073 nested if fixture using existing constant if support","timestamp":1779141938648,"segment":0,"confidence":4,"asi":{"hypothesis":"Nested if expressions should compose through the existing recursive expression parser and constant evaluator with no new compiler feature.","original_fixture":"compiler/syn/tests/fixtures/0073_if_nested.ml","translated_fixture":"compiler/fixtures/programs/imported/syn/0073_if_nested.ml","feature_added":"No new compiler feature; exercised an if expression nested inside a then branch.","validation":"env LLVM_SYS_221_PREFIX=/opt/homebrew/opt/llvm cargo test --manifest-path compiler/stage0/Cargo.toml passed","suggested_next_fixture":"compiler/syn/tests/fixtures/0074_if_complex_branches.ml"}}
{"run":42,"commit":"af238ae","metric":42,"metrics":{"wall_s":12.5},"status":"keep","description":"Imported syn 0074 if complex branches fixture using existing arithmetic branch support","timestamp":1779141964366,"segment":0,"confidence":3.9047619047619047,"asi":{"hypothesis":"If branches containing constant arithmetic expressions should compile through existing recursive if branch parsing and constant evaluation.","original_fixture":"compiler/syn/tests/fixtures/0074_if_complex_branches.ml","translated_fixture":"compiler/fixtures/programs/imported/syn/0074_if_complex_branches.ml","feature_added":"No new compiler feature; exercised arithmetic expressions as if branches.","validation":"env LLVM_SYS_221_PREFIX=/opt/homebrew/opt/llvm cargo test --manifest-path compiler/stage0/Cargo.toml passed","suggested_next_fixture":"compiler/syn/tests/fixtures/0075_if_paren_condition.ml"}}
{"run":43,"commit":"eb5ca59","metric":43,"metrics":{"wall_s":16.4},"status":"keep","description":"Imported syn 0075 if condition fixture using existing bool bindings, &&, and if support","timestamp":1779142063978,"segment":0,"confidence":3.8181818181818183,"asi":{"hypothesis":"The old if condition fixture can be translated by making the formerly free booleans local RiotML bindings and reusing existing constant && and if evaluation.","original_fixture":"compiler/syn/tests/fixtures/0075_if_paren_condition.ml","translated_fixture":"compiler/fixtures/programs/imported/syn/0075_if_paren_condition.ml","feature_added":"No new compiler feature; exercised if with a conjunction of local boolean bindings as the condition.","validation":"env LLVM_SYS_221_PREFIX=/opt/homebrew/opt/llvm cargo test --manifest-path compiler/stage0/Cargo.toml passed","suggested_next_fixture":"compiler/syn/tests/fixtures/0079_if_string_result.ml"}}
{"run":44,"commit":"1b7c4ac","metric":44,"metrics":{"wall_s":12.7},"status":"keep","description":"Imported syn 0079 if string result fixture using existing local bool condition and string branch support","timestamp":1779142119967,"segment":0,"confidence":3.909090909090909,"asi":{"hypothesis":"The old if string result fixture can be translated by binding the free flag locally and reusing existing constant if evaluation over string branches.","original_fixture":"compiler/syn/tests/fixtures/0079_if_string_result.ml","translated_fixture":"compiler/fixtures/programs/imported/syn/0079_if_string_result.ml","feature_added":"No new compiler feature; exercised if with a local boolean path condition and string literal branches.","validation":"env LLVM_SYS_221_PREFIX=/opt/homebrew/opt/llvm cargo test --manifest-path compiler/stage0/Cargo.toml passed","suggested_next_fixture":"compiler/syn/tests/fixtures/0080_if_bool_result.ml"}}
{"run":45,"commit":"312bd41","metric":45,"metrics":{"wall_s":15.6},"status":"keep","description":"Imported syn 0080 if bool result fixture using existing local bool condition and bool branch support","timestamp":1779142179172,"segment":0,"confidence":4,"asi":{"hypothesis":"The old if bool result fixture can be translated by binding the free condition locally and reusing existing constant if evaluation over bool branches.","original_fixture":"compiler/syn/tests/fixtures/0080_if_bool_result.ml","translated_fixture":"compiler/fixtures/programs/imported/syn/0080_if_bool_result.ml","feature_added":"No new compiler feature; exercised if with a local boolean path condition and boolean literal branches.","validation":"env LLVM_SYS_221_PREFIX=/opt/homebrew/opt/llvm cargo test --manifest-path compiler/stage0/Cargo.toml passed","suggested_next_fixture":"compiler/typ/tests/fixtures/corpus/0009_choose_bool.ml"}}
{"run":46,"commit":"6762536","metric":46,"metrics":{"wall_s":13.4},"status":"keep","description":"Imported typ 0009 choose bool fixture by inlining the choice with existing local bindings and if support","timestamp":1779142224238,"segment":0,"confidence":3.9130434782608696,"asi":{"hypothesis":"The typ choose_bool fixture can grow branching coverage without function-parameter support by translating the deterministic call into local bindings plus an equivalent RiotML if expression.","original_fixture":"compiler/typ/tests/fixtures/corpus/0009_choose_bool.ml","translated_fixture":"compiler/fixtures/programs/imported/typ/0009_choose_bool.ml","feature_added":"No new compiler feature; exercised if selection between local boolean bindings in a typ corpus fixture.","validation":"env LLVM_SYS_221_PREFIX=/opt/homebrew/opt/llvm cargo test --manifest-path compiler/stage0/Cargo.toml passed","suggested_next_fixture":"compiler/typ/tests/fixtures/corpus/0011_choose_int.ml"}}
{"run":47,"commit":"5e44d5c","metric":47,"metrics":{"wall_s":14.6},"status":"keep","description":"Imported typ 0011 choose int fixture by inlining the deterministic choice with existing local bindings and if support","timestamp":1779142275604,"segment":0,"confidence":3.8333333333333335,"asi":{"hypothesis":"The typ choose_int fixture can be translated without function-parameter support by preserving the deterministic call semantics as local bindings plus an equivalent RiotML if expression.","original_fixture":"compiler/typ/tests/fixtures/corpus/0011_choose_int.ml","translated_fixture":"compiler/fixtures/programs/imported/typ/0011_choose_int.ml","feature_added":"No new compiler feature; exercised if selection between local integer bindings in a typ corpus fixture.","validation":"env LLVM_SYS_221_PREFIX=/opt/homebrew/opt/llvm cargo test --manifest-path compiler/stage0/Cargo.toml passed","suggested_next_fixture":"compiler/typ/tests/fixtures/corpus/0012_choose_string.ml"}}
{"run":48,"commit":"ed14873","metric":48,"metrics":{"wall_s":13.6},"status":"keep","description":"Imported typ 0012 choose string fixture by inlining the deterministic choice with existing local bindings and if support","timestamp":1779142323705,"segment":0,"confidence":3.9166666666666665,"asi":{"hypothesis":"The typ choose_string fixture can be translated without function-parameter support by preserving the deterministic call semantics as local bindings plus an equivalent RiotML if expression.","original_fixture":"compiler/typ/tests/fixtures/corpus/0012_choose_string.ml","translated_fixture":"compiler/fixtures/programs/imported/typ/0012_choose_string.ml","feature_added":"No new compiler feature; exercised if selection between local string bindings in a typ corpus fixture.","validation":"env LLVM_SYS_221_PREFIX=/opt/homebrew/opt/llvm cargo test --manifest-path compiler/stage0/Cargo.toml passed","suggested_next_fixture":"compiler/typ/tests/fixtures/corpus/0010_choose_char.ml"}}
{"run":49,"commit":"0880224","metric":49,"metrics":{"wall_s":70.7},"status":"keep","description":"Imported typ 0010 choose char fixture with narrow char literal and println support","timestamp":1779142490624,"segment":0,"confidence":4,"asi":{"hypothesis":"The typ choose_char fixture is the smallest next fixture after choose bool/int/string; adding constant char literal parsing and printing should cover it without broader function-parameter support.","original_fixture":"compiler/typ/tests/fixtures/corpus/0010_choose_char.ml","translated_fixture":"compiler/fixtures/programs/imported/typ/0010_choose_char.ml","feature_added":"Parser/checker support for character literals, selected through existing local bindings and if evaluation; println renders the chosen char as a one-character string.","validation":"env LLVM_SYS_221_PREFIX=/opt/homebrew/opt/llvm cargo test --manifest-path compiler/stage0/Cargo.toml passed","suggested_next_fixture":"compiler/typ/tests/fixtures/corpus/0016_const_char_a.ml"}}
