{"run":85,"commit":"dd6722c","metric":68,"metrics":{"wall_s":36.8},"status":"keep","description":"feat(stage0): import syn 0212 record-in-tuple fixture","timestamp":1779148468895,"segment":2,"confidence":3.6,"asi":{"hypothesis":"Record-in-tuple is a more meaningful next record fixture than a two-field record because it exercises composition of record constants with tuple rendering rather than just adding an arity-only field variation.","original_fixture":"compiler/syn/tests/fixtures/0212_record_in_tuple.ml","translated_fixture":"compiler/fixtures/programs/imported/syn/0212_record_in_tuple.ml","feature_added":"No new compiler feature; exercised existing record constants as tuple elements under dbg rendering.","dedup_similarity_check":"Skipped 0203_record_two_fields because normalized distance to one-field record was 4 and it mostly adds a field-count variation. Selected record_in_tuple with distance 13 to record_one_field and explicit aggregate composition.","ebnf_consulted":"compiler/riotml.ebnf permits record_expr as a primary expr and tuple_expr items are expr, so records may appear inside tuples; old OCaml record field `=` translated to RiotML `:` and explicit `Point` path.","validation":"env LLVM_SYS_221_PREFIX=/opt/homebrew/opt/llvm INSTA_UPDATE=always cargo test --manifest-path compiler/stage0/Cargo.toml && env LLVM_SYS_221_PREFIX=/opt/homebrew/opt/llvm cargo test --manifest-path compiler/stage0/Cargo.toml passed","suggested_next_fixture":"compiler/syn/tests/fixtures/0213_record_in_list.ml as record/list composition, unless too similar to this tuple composition."}}
{"run":86,"commit":"feat-st","metric":69,"metrics":{"wall_s":34.9},"status":"keep","description":"feat(stage0): import syn 0205 nested record fixture","timestamp":1779149210368,"segment":2,"confidence":3.8,"asi":{"hypothesis":"Nested records are a more meaningful record follow-up than record-in-list because they exercise recursive record parsing/rendering and field values that are themselves record expressions.","original_fixture":"compiler/syn/tests/fixtures/0205_record_nested.ml","translated_fixture":"compiler/fixtures/programs/imported/syn/0205_record_nested.ml","feature_added":"Recursive record constant parsing/checking/rendering via existing record support; no broad record update or field access semantics added.","dedup_similarity_check":"Normalized Levenshtein selected nested record over record-in-list: record-in-list was distance 3 from record-in-tuple, while nested record was distance 24+ from existing record fixtures.","ebnf_consulted":"compiler/riotml.ebnf record_expr fields are lower_ident ':' expr, so a field value may be another record_expr; old OCaml field '=' was translated to RiotML ':'.","validation":"env LLVM_SYS_221_PREFIX=/opt/homebrew/opt/llvm INSTA_UPDATE=always cargo test --manifest-path compiler/stage0/Cargo.toml && env LLVM_SYS_221_PREFIX=/opt/homebrew/opt/llvm cargo test --manifest-path compiler/stage0/Cargo.toml passed","shared_repo_note":"Per user instruction, no destructive git operations or reverts were used; after an intermediate failure due to concurrent parser/checker refactor state, continued forward and validated the final combined worktree."}}
{"run":87,"commit":"2ae2f52","metric":70,"metrics":{"wall_s":27},"status":"keep","description":"feat(stage0): import syn 0207 record field access fixture","timestamp":1779149364610,"segment":2,"confidence":4,"asi":{"hypothesis":"Record field access is a meaningful next feature from riotml.ebnf field_suffix: resolving a field from a local constant record pushes checker constant evaluation beyond construction/rendering while staying narrow.","original_fixture":"compiler/syn/tests/fixtures/0207_record_field_access.ml","translated_fixture":"compiler/fixtures/programs/imported/syn/0207_record_field_access.ml","feature_added":"Checker constant evaluation for dotted field paths over local constant records, reusing existing parser path handling for `point.x`.","dedup_similarity_check":"Normalized Levenshtein nearest distance was 18 to record_one_field, indicating this is structurally distinct and not a value-only record variation.","ebnf_consulted":"compiler/riotml.ebnf defines postfix field_suffix as `.` ident; current stage0 parses dotted paths and this iteration gives lowercase local record field paths semantics.","validation":"env LLVM_SYS_221_PREFIX=/opt/homebrew/opt/llvm INSTA_UPDATE=always cargo test --manifest-path compiler/stage0/Cargo.toml && env LLVM_SYS_221_PREFIX=/opt/homebrew/opt/llvm cargo test --manifest-path compiler/stage0/Cargo.toml passed","non_destructive_note":"An intermediate compile error was fixed forward without revert/reset/stash, per shared-repo workflow."}}
{"run":88,"commit":"444620c","metric":71,"metrics":{"wall_s":27.6},"status":"keep","description":"feat(stage0): import syn 0208 nested record access fixture","timestamp":1779149468977,"segment":2,"confidence":3.8181818181818183,"asi":{"hypothesis":"Nested record field access is a meaningful extension of field_suffix coverage because existing dotted-path constant evaluation should resolve multiple field suffixes through nested record constants.","original_fixture":"compiler/syn/tests/fixtures/0208_record_nested_access.ml","translated_fixture":"compiler/fixtures/programs/imported/syn/0208_record_nested_access.ml","feature_added":"No new compiler feature; exercised existing dotted path constant evaluation over nested record values (`obj.field.subfield`).","dedup_similarity_check":"Normalized nearest distance was 42, so this is structurally distinct from one-level record field access and other aggregate fixtures.","ebnf_consulted":"compiler/riotml.ebnf defines postfix field_suffix as `.` lower_ident; chained field suffixes are allowed through postfix_suffix* and represented by stage0 as dotted paths.","validation":"env LLVM_SYS_221_PREFIX=/opt/homebrew/opt/llvm INSTA_UPDATE=always cargo test --manifest-path compiler/stage0/Cargo.toml && env LLVM_SYS_221_PREFIX=/opt/homebrew/opt/llvm cargo test --manifest-path compiler/stage0/Cargo.toml passed","suggested_next_fixture":"compiler/syn/tests/fixtures/0206_record_with_expr.ml if translated without unsupported call field, or move to record/list composition."}}
{"run":89,"commit":"c735cc5","metric":72,"metrics":{"wall_s":37.6},"status":"keep","description":"feat(stage0): import syn 0213 record-in-list fixture","timestamp":1779149958816,"segment":2,"confidence":3.6666666666666665,"asi":{"hypothesis":"Record-in-list adds meaningful aggregate composition coverage by rendering records inside a list; it is preferable to record_with_expr for now because the latter contains an unsupported old function application in a field value.","original_fixture":"compiler/syn/tests/fixtures/0213_record_in_list.ml","translated_fixture":"compiler/fixtures/programs/imported/syn/0213_record_in_list.ml","feature_added":"No new compiler feature; exercised existing record constants as list elements under dbg rendering.","dedup_similarity_check":"Normalized nearest distance was 3 to record_in_tuple, so this is somewhat similar; kept because it validates list rendering over record elements, but future record-in-container variants should be scrutinized more heavily.","ebnf_consulted":"compiler/riotml.ebnf permits record_expr as primary expr and list_expr_item as expr, so records may appear inside lists; old OCaml semicolon separators translated to RiotML commas.","validation":"env LLVM_SYS_221_PREFIX=/opt/homebrew/opt/llvm INSTA_UPDATE=always cargo test --manifest-path compiler/stage0/Cargo.toml && env LLVM_SYS_221_PREFIX=/opt/homebrew/opt/llvm cargo test --manifest-path compiler/stage0/Cargo.toml passed","suggested_next_fixture":"Consider implementing a narrow top-level zero-arg helper function or const call support before importing old fixtures with `f 3` field/list elements."}}
{"run":90,"commit":"72602db","metric":73,"metrics":{"wall_s":28.6},"status":"keep","description":"feat(stage0): import typ 0042 identity int fixture","timestamp":1779150222910,"segment":2,"confidence":3.8333333333333335,"asi":{"hypothesis":"A one-parameter top-level identity helper is the smallest useful function-call slice and unlocks many typ identity/apply fixtures while keeping stage0 narrow by evaluating only constant helper calls at compile time.","original_fixture":"compiler/typ/tests/fixtures/corpus/0042_identity_int_one.ml","translated_fixture":"compiler/fixtures/programs/imported/typ/0042_identity_int_one.ml","feature_added":"Parser support for simple top-level function parameters and checker constant evaluation for calls to non-main helper functions with expression-only bodies.","dedup_similarity_check":"Identity int overlaps with existing const int fixtures, but is kept because it introduces a new compiler capability: top-level helper parameter parsing and constant call evaluation.","ebnf_consulted":"compiler/riotml.ebnf fn_decl permits param_list and postfix call_suffix permits `id(value)`; old OCaml `id value` was translated to RiotML call syntax.","validation":"env LLVM_SYS_221_PREFIX=/opt/homebrew/opt/llvm INSTA_UPDATE=always cargo test --manifest-path compiler/stage0/Cargo.toml && env LLVM_SYS_221_PREFIX=/opt/homebrew/opt/llvm cargo test --manifest-path compiler/stage0/Cargo.toml passed","non_destructive_note":"Preserved shared worktree changes and fixed forward only."}}
{"run":91,"commit":"b1feadb","metric":74,"metrics":{"wall_s":37.7},"status":"keep","description":"feat(stage0): import typ 0046 identity nested tuple fixture","timestamp":1779150339032,"segment":2,"confidence":4,"asi":{"hypothesis":"After adding constant helper call evaluation, an identity fixture over a nested tuple meaningfully exercises function calls over aggregate values rather than adding another scalar identity duplicate.","original_fixture":"compiler/typ/tests/fixtures/corpus/0046_identity_nested_tuple.ml","translated_fixture":"compiler/fixtures/programs/imported/typ/0046_identity_nested_tuple.ml","feature_added":"No new compiler feature; exercised top-level helper function parameter binding and constant call evaluation over a nested tuple value.","dedup_similarity_check":"Normalized nearest distance was 11 to identity_int_one and much farther to aggregate fixtures, so this is a meaningful aggregate-call composition rather than a value-only duplicate.","ebnf_consulted":"compiler/riotml.ebnf allows fn_decl params, call_suffix `(...)`, and tuple_expr values; old OCaml `id value` translated to RiotML `id(value)`.","validation":"env LLVM_SYS_221_PREFIX=/opt/homebrew/opt/llvm INSTA_UPDATE=always cargo test --manifest-path compiler/stage0/Cargo.toml && env LLVM_SYS_221_PREFIX=/opt/homebrew/opt/llvm cargo test --manifest-path compiler/stage0/Cargo.toml passed","suggested_next_fixture":"compiler/typ/tests/fixtures/corpus/0045_identity_list_ints.ml for function calls over list values, or move to const function with multiple params."}}
{"run":92,"commit":"a3ee965","metric":75,"metrics":{"wall_s":28.4},"status":"keep","description":"feat(stage0): import typ 0045 identity list fixture","timestamp":1779150436444,"segment":2,"confidence":3.8461538461538463,"asi":{"hypothesis":"After helper-call constant evaluation landed, identity over a list value meaningfully exercises function calls over list aggregates, complementing identity over nested tuples without adding a new broad feature.","original_fixture":"compiler/typ/tests/fixtures/corpus/0045_identity_list_ints.ml","translated_fixture":"compiler/fixtures/programs/imported/typ/0045_identity_list_ints.ml","feature_added":"No new compiler feature; exercised top-level helper function parameter binding and constant call evaluation over a list value.","dedup_similarity_check":"Normalized nearest distance was 6 to identity_int_one and 8 to identity_nested_tuple; kept because it combines the new helper-call path with list aggregate values rather than scalar values.","ebnf_consulted":"compiler/riotml.ebnf allows fn_decl params, call_suffix `(...)`, and list_expr values; old OCaml list semicolons translated to RiotML commas and `id value` to `id(value)`.","validation":"env LLVM_SYS_221_PREFIX=/opt/homebrew/opt/llvm INSTA_UPDATE=always cargo test --manifest-path compiler/stage0/Cargo.toml && env LLVM_SYS_221_PREFIX=/opt/homebrew/opt/llvm cargo test --manifest-path compiler/stage0/Cargo.toml passed","suggested_next_fixture":"Consider a multi-parameter helper such as choose/apply only if implemented narrowly, or tuple projection via field/pattern once stage0 supports that concept."}}
{"run":93,"commit":"00df066","metric":76,"metrics":{"wall_s":28.7},"status":"keep","description":"feat(stage0): import typ 0030 const tuple string char fixture","timestamp":1779150549598,"segment":2,"confidence":3.7142857142857144,"asi":{"hypothesis":"A const-style helper with two parameters is the smallest next function-call composition after unary identity helpers, and this fixture also exercises tuple values containing string and char elements.","original_fixture":"compiler/typ/tests/fixtures/corpus/0030_const_tuple_string_char.ml","translated_fixture":"compiler/fixtures/programs/imported/typ/0030_const_tuple_string_char.ml","feature_added":"No new compiler feature; exercised existing multi-parameter top-level helper parsing and constant call evaluation with a tuple/string/char value plus unit ignored argument.","dedup_similarity_check":"Normalized nearest distance was 27 to identity list/int fixtures and 52 to const tuple int/bool, so this is structurally distinct enough to keep.","ebnf_consulted":"compiler/riotml.ebnf permits function param_list, unit literal `()`, tuple_expr values, and call_suffix `keep(value, ())`; old OCaml `const value ()` translated to RiotML call syntax.","validation":"env LLVM_SYS_221_PREFIX=/opt/homebrew/opt/llvm INSTA_UPDATE=always cargo test --manifest-path compiler/stage0/Cargo.toml && env LLVM_SYS_221_PREFIX=/opt/homebrew/opt/llvm cargo test --manifest-path compiler/stage0/Cargo.toml passed","suggested_next_fixture":"A two-argument arithmetic/helper fixture or higher-order apply once function values are represented; avoid value-only const helper variants."}}
{"run":94,"commit":"22198cb","metric":77,"metrics":{"wall_s":39},"status":"keep","description":"feat(stage0): import typ 0077 duplicate bool fixture","timestamp":1779150659323,"segment":2,"confidence":3.857142857142857,"asi":{"hypothesis":"A duplicate helper is a meaningful next function fixture because it exercises reusing one parameter multiple times inside a returned tuple, unlike identity/const helpers that only forward one value.","original_fixture":"compiler/typ/tests/fixtures/corpus/0077_duplicate_bool.ml","translated_fixture":"compiler/fixtures/programs/imported/typ/0077_duplicate_bool.ml","feature_added":"No new compiler feature; exercised existing helper-call constant evaluation with repeated parameter references in a tuple result.","dedup_similarity_check":"Normalized nearest distance was 32 to identity_int_one and 41 to const tuple int/bool, so this is structurally distinct enough to keep.","ebnf_consulted":"compiler/riotml.ebnf permits fn_decl params, tuple_expr values, path expressions as tuple elements, and call_suffix `duplicate(true)`.","validation":"env LLVM_SYS_221_PREFIX=/opt/homebrew/opt/llvm INSTA_UPDATE=always cargo test --manifest-path compiler/stage0/Cargo.toml && env LLVM_SYS_221_PREFIX=/opt/homebrew/opt/llvm cargo test --manifest-path compiler/stage0/Cargo.toml passed","suggested_next_fixture":"Consider another function-composition fixture only if it introduces new semantics, e.g. higher-order function values; otherwise continue with record/field/list features."}}
{"run":95,"commit":"5077039","metric":78,"metrics":{"wall_s":30.7},"status":"keep","description":"feat(stage0): import typ 0080 duplicate tuple fixture","timestamp":1779150781975,"segment":2,"confidence":4,"asi":{"hypothesis":"Duplicate over a tuple value is a meaningful extension of the duplicate helper because it exercises repeated parameter use with aggregate inputs/outputs rather than another scalar duplicate.","original_fixture":"compiler/typ/tests/fixtures/corpus/0080_duplicate_tuple.ml","translated_fixture":"compiler/fixtures/programs/imported/typ/0080_duplicate_tuple.ml","feature_added":"No new compiler feature; exercised existing helper-call constant evaluation with repeated tuple-valued parameter references.","dedup_similarity_check":"Skipped duplicate_int and duplicate_list as too close to duplicate_bool (list nearest distance 4); kept duplicate_tuple with distance 7 because aggregate tuple repetition is a more distinct structural case.","ebnf_consulted":"compiler/riotml.ebnf permits fn_decl params, tuple_expr values, path expressions as tuple elements, and call_suffix `duplicate((0, 'x'))`.","validation":"env LLVM_SYS_221_PREFIX=/opt/homebrew/opt/llvm INSTA_UPDATE=always cargo test --manifest-path compiler/stage0/Cargo.toml && env LLVM_SYS_221_PREFIX=/opt/homebrew/opt/llvm cargo test --manifest-path compiler/stage0/Cargo.toml passed","shared_repo_note":"User noted another agent is adding actor primitives; preserve their work. If actor-related changes conflict with future iterations, wait/retry rather than reverting or overwriting."}}
{"run":96,"commit":"crash96","metric":0,"metrics":{"wall_s":16.8},"status":"crash","description":"feat(stage0): try importing typ 0071 shadow tuple fixture","timestamp":1779150850377,"segment":2,"confidence":4,"asi":{"hypothesis":"Shadowing a local binding with a tuple aggregate would meaningfully exercise let-binding scope semantics beyond ordinary distinct local names without adding broad runtime behavior.","original_fixture":"compiler/typ/tests/fixtures/corpus/0071_shadow_tuple.ml","translated_fixture":"compiler/fixtures/programs/imported/typ/0071_shadow_tuple.ml","failure":"Stage0 rejects duplicate local names in a block with `duplicate local binding`; the translated nested-let shadowing fixture cannot compile under current checker rules.","rollback_reason":"Validation failed before metric improvement; fixture requires an explicit, source-backed decision to allow scoped shadowing or a more faithful nested block translation rather than weakening duplicate-binding diagnostics accidentally.","next_action_hint":"Either implement narrow nested block expression/local scope support for old OCaml nested `let ... in` shadowing, or skip shadow fixtures and continue with non-shadowing candidates such as higher-order apply or supported aggregate/helper fixtures.","shared_repo_note":"Preserve other agent actor primitive work; wait/retry rather than reverting unrelated actor changes."}}
{"run":97,"commit":"crash97","metric":0,"metrics":{"wall_s":44.6},"status":"crash","description":"feat(stage0): try importing typ 0066 nested let tuple fixture","timestamp":1779151639570,"segment":2,"confidence":4,"asi":{"hypothesis":"A nested-let tuple fixture can grow local alias-chain coverage without new compiler features by translating old OCaml nested `let ... in` bindings to equivalent sequential RiotML local bindings.","original_fixture":"compiler/typ/tests/fixtures/corpus/0066_nested_let_tuple.ml","translated_fixture":"compiler/fixtures/programs/imported/typ/0066_nested_let_tuple.ml","failure":"Validation failed because unrelated actor fixture files from the concurrent actor-primitives agent were visible and four actor program fixture tests failed; the imported nested-let tuple fixture itself generated a snapshot and was not the apparent failing test.","rollback_reason":"Must not commit or revert another agent's actor work; stashed actor-related untracked files before logging crash, letting autoresearch revert only this attempted fixture.","next_action_hint":"After preserving/restoring actor work, rerun the nested-let tuple import in a clean or actor-compatible worktree; if actor changes remain active, wait/retry rather than overwriting them.","shared_repo_note":"Another agent is adding actor primitives; do not undo their work. Actor files were stashed to protect them from autoresearch auto-revert."}}
{"run":98,"commit":"crash98","metric":0,"metrics":{"wall_s":17.3},"status":"crash","description":"feat(stage0): retry importing typ 0066 nested let tuple fixture","timestamp":1779151720089,"segment":2,"confidence":4,"asi":{"hypothesis":"A nested-let tuple fixture can grow local alias-chain coverage without new compiler features by translating old OCaml nested `let ... in` bindings to equivalent sequential RiotML local bindings.","original_fixture":"compiler/typ/tests/fixtures/corpus/0066_nested_let_tuple.ml","translated_fixture":"compiler/fixtures/programs/imported/typ/0066_nested_let_tuple.ml","failure":"Validation failed because stashing the actor agent's runtime changes left the checked-out runtime unable to produce compiler/rt/target/release/libriot_rt.a; unrelated snapshots were updated to failure before the run stopped. The new nested-let tuple fixture itself passed.","rollback_reason":"Need a clean runtime build state before validating; allow autoresearch to revert the attempted fixture and failed snapshot updates, then rerun after building/restoring the runtime in a way that does not overwrite actor work.","next_action_hint":"Run or restore the runtime build artifact before rerunning the nested-let tuple import; keep actor primitive work stashed/restored around the experiment and do not commit actor files.","shared_repo_note":"Actor work is preserved in a stash during this experiment; restore it after the autoresearch validation/logging cycle."}}
