{"type":"config","name":"Grow RiotML imported fixture corpus with minimal stage0 support","metricName":"passing_imported_fixtures","metricUnit":"","bestDirection":"higher"}
{"run":1,"commit":"593ae70","metric":1,"metrics":{"wall_s":3.5},"status":"keep","description":"Baseline with existing imported syn fixture count","timestamp":1779140254504,"segment":0,"confidence":null,"asi":{"hypothesis":"Measure current passing imported fixture corpus before adding translated fixtures."}}
{"run":2,"commit":"5781edb","metric":2,"metrics":{"wall_s":3.4},"status":"keep","description":"Imported syn 0017 string literal fixture using existing local string let and println support","timestamp":1779140290306,"segment":0,"confidence":null,"asi":{"hypothesis":"A simple old syn string binding translates directly to a RiotML main with a local string let and deterministic println, increasing corpus without compiler changes.","original_fixture":"compiler/syn/tests/fixtures/0017_string_simple.ml","translated_fixture":"compiler/fixtures/programs/imported/syn/0017_string_simple.ml","feature_added":"No new compiler feature; exercised existing local string let, path expression, and println support.","validation":"env LLVM_SYS_221_PREFIX=/opt/homebrew/opt/llvm cargo test --manifest-path compiler/stage0/Cargo.toml passed","suggested_next_fixture":"compiler/syn/tests/fixtures/0016_string_empty.ml"}}
{"run":3,"commit":"f8f5310","metric":3,"metrics":{"wall_s":5},"status":"keep","description":"Imported syn 0016 empty string fixture with deterministic blank-line stdout","timestamp":1779140354543,"segment":0,"confidence":2,"asi":{"hypothesis":"An empty string binding is supported by existing stage0 string handling and adds corpus coverage for zero-length literals.","original_fixture":"compiler/syn/tests/fixtures/0016_string_empty.ml","translated_fixture":"compiler/fixtures/programs/imported/syn/0016_string_empty.ml","feature_added":"No new compiler feature; covered existing empty string literal through local let and println.","validation":"env LLVM_SYS_221_PREFIX=/opt/homebrew/opt/llvm cargo test --manifest-path compiler/stage0/Cargo.toml passed","suggested_next_fixture":"compiler/syn/tests/fixtures/0029_paren_string.ml"}}
{"run":4,"commit":"0034c0f","metric":4,"metrics":{"wall_s":5.5},"status":"keep","description":"Imported syn 0029 parenthesized string fixture and added narrow parenthesized expression parsing","timestamp":1779140380115,"segment":0,"confidence":3,"asi":{"hypothesis":"Adding parser-only support for parenthesized expressions is the smallest feature needed for the old parenthesized string fixture.","original_fixture":"compiler/syn/tests/fixtures/0029_paren_string.ml","translated_fixture":"compiler/fixtures/programs/imported/syn/0029_paren_string.ml","feature_added":"Parenthesized expressions in stage0 parser, preserving existing AST/checker/IR by returning the inner expression.","validation":"env LLVM_SYS_221_PREFIX=/opt/homebrew/opt/llvm cargo test --manifest-path compiler/stage0/Cargo.toml passed","suggested_next_fixture":"compiler/syn/tests/fixtures/0003_let_with_bool.ml"}}
{"run":5,"commit":"648c05d","metric":5,"metrics":{"wall_s":5.6},"status":"keep","description":"Imported syn 0003 bool let fixture with narrow bool literal println support","timestamp":1779140433555,"segment":0,"confidence":4,"asi":{"hypothesis":"A small constant-value path through parser and checker can support boolean literals and println without adding general boolean operations.","original_fixture":"compiler/syn/tests/fixtures/0003_let_with_bool.ml","translated_fixture":"compiler/fixtures/programs/imported/syn/0003_let_with_bool.ml","feature_added":"Boolean literals in parser/checker; println of constant bool values lowers to runtime string output true/false.","validation":"env LLVM_SYS_221_PREFIX=/opt/homebrew/opt/llvm cargo test --manifest-path compiler/stage0/Cargo.toml passed","suggested_next_fixture":"compiler/syn/tests/fixtures/0019_bool_false.ml"}}
{"run":6,"commit":"8c010a0","metric":6,"metrics":{"wall_s":4.2},"status":"keep","description":"Imported syn 0019 false literal fixture using existing bool println path","timestamp":1779140449435,"segment":0,"confidence":3.3333333333333335,"asi":{"hypothesis":"The newly added bool constant support should handle false literals directly and grow coverage with no additional compiler changes.","original_fixture":"compiler/syn/tests/fixtures/0019_bool_false.ml","translated_fixture":"compiler/fixtures/programs/imported/syn/0019_bool_false.ml","feature_added":"No new compiler feature; covered false branch of boolean literal printing.","validation":"env LLVM_SYS_221_PREFIX=/opt/homebrew/opt/llvm cargo test --manifest-path compiler/stage0/Cargo.toml passed","suggested_next_fixture":"compiler/syn/tests/fixtures/0030_paren_bool.ml"}}
{"run":7,"commit":"2079fae","metric":7,"metrics":{"wall_s":4.3},"status":"keep","description":"Imported syn 0030 parenthesized bool fixture using existing paren and bool support","timestamp":1779140466743,"segment":0,"confidence":3,"asi":{"hypothesis":"The combination of parenthesized expression parsing and bool constant support should cover parenthesized bool fixtures without further compiler changes.","original_fixture":"compiler/syn/tests/fixtures/0030_paren_bool.ml","translated_fixture":"compiler/fixtures/programs/imported/syn/0030_paren_bool.ml","feature_added":"No new compiler feature; exercised parenthesized boolean literal printing.","validation":"env LLVM_SYS_221_PREFIX=/opt/homebrew/opt/llvm cargo test --manifest-path compiler/stage0/Cargo.toml passed","suggested_next_fixture":"compiler/syn/tests/fixtures/0001_basic.ml"}}
{"run":8,"commit":"daaaaef","metric":8,"metrics":{"wall_s":6.5},"status":"keep","description":"Imported syn 0001 integer binding fixture with narrow decimal int println support","timestamp":1779140505374,"segment":0,"confidence":3.5,"asi":{"hypothesis":"A decimal integer constant can reuse the constant println lowering path by rendering the checked constant to a string before runtime emission.","original_fixture":"compiler/syn/tests/fixtures/0001_basic.ml","translated_fixture":"compiler/fixtures/programs/imported/syn/0001_basic.ml","feature_added":"Positive decimal integer literals in parser/checker; println of constant integers emits their decimal string representation.","validation":"env LLVM_SYS_221_PREFIX=/opt/homebrew/opt/llvm cargo test --manifest-path compiler/stage0/Cargo.toml passed","suggested_next_fixture":"compiler/syn/tests/fixtures/0004_multiple_lets.ml"}}
{"run":9,"commit":"e6e8e39","metric":9,"metrics":{"wall_s":5},"status":"keep","description":"Imported syn 0004 multiple let bindings fixture using existing constant binding support","timestamp":1779140522052,"segment":0,"confidence":4,"asi":{"hypothesis":"Multiple local lets are already accepted by stage0, so the old two-binding fixture can grow corpus coverage after integer constants landed.","original_fixture":"compiler/syn/tests/fixtures/0004_multiple_lets.ml","translated_fixture":"compiler/fixtures/programs/imported/syn/0004_multiple_lets.ml","feature_added":"No new compiler feature; exercised multiple integer local let bindings and final println.","validation":"env LLVM_SYS_221_PREFIX=/opt/homebrew/opt/llvm cargo test --manifest-path compiler/stage0/Cargo.toml passed","suggested_next_fixture":"compiler/syn/tests/fixtures/0005_addition.ml"}}
{"run":10,"commit":"ad5c181","metric":10,"metrics":{"wall_s":7.2},"status":"keep","description":"Imported syn 0005 addition fixture with narrow constant integer + support","timestamp":1779140575221,"segment":0,"confidence":3.6,"asi":{"hypothesis":"A one-operator parser/checker slice for constant integer addition is enough to compile the old addition fixture while keeping lowering unchanged.","original_fixture":"compiler/syn/tests/fixtures/0005_addition.ml","translated_fixture":"compiler/fixtures/programs/imported/syn/0005_addition.ml","feature_added":"Parser and checker support for a single binary + over constant integers; result is rendered via existing constant println path.","validation":"env LLVM_SYS_221_PREFIX=/opt/homebrew/opt/llvm cargo test --manifest-path compiler/stage0/Cargo.toml passed","suggested_next_fixture":"compiler/syn/tests/fixtures/0031_add_two_ints.ml"}}
{"run":11,"commit":"72bc9f0","metric":11,"metrics":{"wall_s":5.3},"status":"keep","description":"Imported syn 0031 add two ints fixture using existing constant addition support","timestamp":1779140591531,"segment":0,"confidence":3.3333333333333335,"asi":{"hypothesis":"The addition support added for syn 0005 should also handle the duplicate add-two-ints corpus case with no compiler changes.","original_fixture":"compiler/syn/tests/fixtures/0031_add_two_ints.ml","translated_fixture":"compiler/fixtures/programs/imported/syn/0031_add_two_ints.ml","feature_added":"No new compiler feature; covered constant addition with a different provenance fixture.","validation":"env LLVM_SYS_221_PREFIX=/opt/homebrew/opt/llvm cargo test --manifest-path compiler/stage0/Cargo.toml passed","suggested_next_fixture":"compiler/syn/tests/fixtures/0032_sub_two_ints.ml"}}
{"run":12,"commit":"0bfe7eb","metric":12,"metrics":{"wall_s":8.2},"status":"keep","description":"Imported syn 0032 subtraction fixture with narrow constant integer - support","timestamp":1779140634818,"segment":0,"confidence":3.6666666666666665,"asi":{"hypothesis":"A single binary subtraction parser/checker path can cover the old subtraction fixture without broad arithmetic or codegen changes.","original_fixture":"compiler/syn/tests/fixtures/0032_sub_two_ints.ml","translated_fixture":"compiler/fixtures/programs/imported/syn/0032_sub_two_ints.ml","feature_added":"Parser/checker support for one constant integer subtraction expression; lowering remains constant println string output.","validation":"env LLVM_SYS_221_PREFIX=/opt/homebrew/opt/llvm cargo test --manifest-path compiler/stage0/Cargo.toml passed","suggested_next_fixture":"compiler/syn/tests/fixtures/0033_mul_two_ints.ml"}}
{"run":13,"commit":"f3f3619","metric":13,"metrics":{"wall_s":10.3},"status":"keep","description":"Imported syn 0033 multiplication fixture with narrow constant integer * support","timestamp":1779140675747,"segment":0,"confidence":4,"asi":{"hypothesis":"A direct parser/checker case for constant integer multiplication is enough for the selected fixture and keeps stage0 lowering unchanged.","original_fixture":"compiler/syn/tests/fixtures/0033_mul_two_ints.ml","translated_fixture":"compiler/fixtures/programs/imported/syn/0033_mul_two_ints.ml","feature_added":"Parser/checker support for one constant integer multiplication expression; result printed through existing constant path.","validation":"env LLVM_SYS_221_PREFIX=/opt/homebrew/opt/llvm cargo test --manifest-path compiler/stage0/Cargo.toml passed","suggested_next_fixture":"compiler/syn/tests/fixtures/0034_div_two_ints.ml"}}
{"run":14,"commit":"6b2b90f","metric":14,"metrics":{"wall_s":10.4},"status":"keep","description":"Imported syn 0034 division fixture with narrow constant integer / support","timestamp":1779140726265,"segment":0,"confidence":3.7142857142857144,"asi":{"hypothesis":"A single constant integer division case can compile the old nonzero division fixture without adding runtime integer values.","original_fixture":"compiler/syn/tests/fixtures/0034_div_two_ints.ml","translated_fixture":"compiler/fixtures/programs/imported/syn/0034_div_two_ints.ml","feature_added":"Parser/checker support for one constant integer division expression; division by zero remains unsupported.","validation":"env LLVM_SYS_221_PREFIX=/opt/homebrew/opt/llvm cargo test --manifest-path compiler/stage0/Cargo.toml passed","suggested_next_fixture":"compiler/syn/tests/fixtures/0035_mod_two_ints.ml"}}
{"run":15,"commit":"c36b693","metric":15,"metrics":{"wall_s":12.1},"status":"keep","description":"Imported syn 0035 modulo fixture with narrow constant integer mod support","timestamp":1779140774181,"segment":0,"confidence":3.5,"asi":{"hypothesis":"A keyword binary expression for constant integer modulo can cover the old mod fixture without implementing wider precedence yet.","original_fixture":"compiler/syn/tests/fixtures/0035_mod_two_ints.ml","translated_fixture":"compiler/fixtures/programs/imported/syn/0035_mod_two_ints.ml","feature_added":"Parser/checker support for one constant integer modulo expression; modulo by zero remains unsupported.","validation":"env LLVM_SYS_221_PREFIX=/opt/homebrew/opt/llvm cargo test --manifest-path compiler/stage0/Cargo.toml passed","suggested_next_fixture":"compiler/syn/tests/fixtures/0036_add_chain.ml"}}
{"run":16,"commit":"ca09058","metric":16,"metrics":{"wall_s":12.5},"status":"keep","description":"Imported syn 0008 negative int fixture, added unary negation, and aligned modulo syntax to RiotML %","timestamp":1779140844075,"segment":0,"confidence":3.75,"asi":{"hypothesis":"Unary negation over an integer constant is the smallest support for the negative integer fixture; the same slice can correct the translated modulo fixture to RiotML's % operator.","original_fixture":"compiler/syn/tests/fixtures/0008_int_negative.ml","translated_fixture":"compiler/fixtures/programs/imported/syn/0008_int_negative.ml","feature_added":"Parser/checker support for unary - over constant integers; modulo parser/fixture uses RiotML % syntax instead of old OCaml mod.","validation":"env LLVM_SYS_221_PREFIX=/opt/homebrew/opt/llvm cargo test --manifest-path compiler/stage0/Cargo.toml passed","suggested_next_fixture":"compiler/syn/tests/fixtures/0009_int_hex.ml"}}
{"run":17,"commit":"5e937b7","metric":17,"metrics":{"wall_s":13.6},"status":"keep","description":"Imported syn 0009 hex int fixture with narrow 0x integer literal parsing","timestamp":1779140882165,"segment":0,"confidence":4,"asi":{"hypothesis":"Adding prefixed hex integer parsing before decimal parsing should support the old hex literal fixture while preserving decimal literals.","original_fixture":"compiler/syn/tests/fixtures/0009_int_hex.ml","translated_fixture":"compiler/fixtures/programs/imported/syn/0009_int_hex.ml","feature_added":"Parser support for 0x/0X integer literals as constant i64 values; checker/printing reused existing integer path.","validation":"env LLVM_SYS_221_PREFIX=/opt/homebrew/opt/llvm cargo test --manifest-path compiler/stage0/Cargo.toml passed","suggested_next_fixture":"compiler/syn/tests/fixtures/0011_int_binary.ml"}}
{"run":18,"commit":"9f4b503","metric":18,"metrics":{"wall_s":15.4},"status":"keep","description":"Imported syn 0011 binary int fixture with narrow 0b integer literal parsing","timestamp":1779140925659,"segment":0,"confidence":3.7777777777777777,"asi":{"hypothesis":"RiotML grammar includes binary integers, so adding 0b/0B parsing should cover the old binary fixture and reuse the integer constant path.","original_fixture":"compiler/syn/tests/fixtures/0011_int_binary.ml","translated_fixture":"compiler/fixtures/programs/imported/syn/0011_int_binary.ml","feature_added":"Parser support for 0b/0B integer literals as constant i64 values; noted old octal fixture as deferred because RiotML grammar lacks octal.","validation":"env LLVM_SYS_221_PREFIX=/opt/homebrew/opt/llvm cargo test --manifest-path compiler/stage0/Cargo.toml passed","suggested_next_fixture":"compiler/syn/tests/fixtures/0036_add_chain.ml"}}
{"run":19,"commit":"1673ac3","metric":19,"metrics":{"wall_s":7.2},"status":"keep","description":"Imported syn 0037 precedence fixture using explicit RiotML parentheses and existing arithmetic support","timestamp":1779140953859,"segment":0,"confidence":3.6,"asi":{"hypothesis":"The old precedence example can be translated with explicit parentheses and should compile using existing nested expression support.","original_fixture":"compiler/syn/tests/fixtures/0037_mul_precedence.ml","translated_fixture":"compiler/fixtures/programs/imported/syn/0037_mul_precedence.ml","feature_added":"No new compiler feature; exercised nested parenthesized multiplication as the right side of addition.","validation":"env LLVM_SYS_221_PREFIX=/opt/homebrew/opt/llvm cargo test --manifest-path compiler/stage0/Cargo.toml passed","suggested_next_fixture":"compiler/syn/tests/fixtures/0038_paren_precedence.ml"}}
{"run":20,"commit":"5b48e83","metric":20,"metrics":{"wall_s":7.4},"status":"keep","description":"Imported syn 0038 parenthesized precedence fixture using existing nested arithmetic support","timestamp":1779140975047,"segment":0,"confidence":3.8,"asi":{"hypothesis":"Parenthesized addition as the left operand of multiplication should be handled by existing parser recursion and constant arithmetic checking.","original_fixture":"compiler/syn/tests/fixtures/0038_paren_precedence.ml","translated_fixture":"compiler/fixtures/programs/imported/syn/0038_paren_precedence.ml","feature_added":"No new compiler feature; exercised parenthesized addition as a multiplication operand.","validation":"env LLVM_SYS_221_PREFIX=/opt/homebrew/opt/llvm cargo test --manifest-path compiler/stage0/Cargo.toml passed","suggested_next_fixture":"compiler/syn/tests/fixtures/0036_add_chain.ml"}}
{"run":21,"commit":"5acd334","metric":21,"metrics":{"wall_s":8.8},"status":"keep","description":"Imported syn 0036 addition chain fixture using explicit grouping accepted by current stage0","timestamp":1779141002199,"segment":0,"confidence":4,"asi":{"hypothesis":"The addition-chain fixture can be translated to equivalent explicitly grouped RiotML syntax and compile with existing nested addition support.","original_fixture":"compiler/syn/tests/fixtures/0036_add_chain.ml","translated_fixture":"compiler/fixtures/programs/imported/syn/0036_add_chain.ml","feature_added":"No new compiler feature; translated the arithmetic chain with explicit parentheses for current narrow parser support.","validation":"env LLVM_SYS_221_PREFIX=/opt/homebrew/opt/llvm cargo test --manifest-path compiler/stage0/Cargo.toml passed","suggested_next_fixture":"compiler/syn/tests/fixtures/0039_mixed_ops.ml"}}
{"run":22,"commit":"fd4314d","metric":22,"metrics":{"wall_s":8.1},"status":"keep","description":"Imported syn 0039 mixed arithmetic fixture with explicit grouping for current parser","timestamp":1779141032926,"segment":0,"confidence":3.8181818181818183,"asi":{"hypothesis":"The mixed arithmetic fixture can be translated with explicit grouping and compile using the already supported constant arithmetic operators.","original_fixture":"compiler/syn/tests/fixtures/0039_mixed_ops.ml","translated_fixture":"compiler/fixtures/programs/imported/syn/0039_mixed_ops.ml","feature_added":"No new compiler feature; exercised nested grouped +, -, *, and / over constants.","validation":"env LLVM_SYS_221_PREFIX=/opt/homebrew/opt/llvm cargo test --manifest-path compiler/stage0/Cargo.toml passed","suggested_next_fixture":"compiler/syn/tests/fixtures/0047_string_eq.ml"}}
{"run":23,"commit":"5efa4da","metric":23,"metrics":{"wall_s":19.1},"status":"keep","description":"Imported syn 0047 string equality fixture with narrow constant == support","timestamp":1779141088999,"segment":0,"confidence":3.6666666666666665,"asi":{"hypothesis":"RiotML equality syntax is ==, so a constant equality checker case can translate and run the old string equality fixture.","original_fixture":"compiler/syn/tests/fixtures/0047_string_eq.ml","translated_fixture":"compiler/fixtures/programs/imported/syn/0047_string_eq.ml","feature_added":"Parser/checker support for == over matching constant bool/int/string values, returning a printable bool constant.","validation":"env LLVM_SYS_221_PREFIX=/opt/homebrew/opt/llvm cargo test --manifest-path compiler/stage0/Cargo.toml passed","suggested_next_fixture":"compiler/syn/tests/fixtures/0048_bool_eq.ml"}}
{"run":24,"commit":"0944959","metric":24,"metrics":{"wall_s":8.4},"status":"keep","description":"Imported syn 0048 bool equality fixture using existing constant == support","timestamp":1779141114695,"segment":0,"confidence":3.8333333333333335,"asi":{"hypothesis":"The constant equality support added for strings should directly cover boolean equality with no additional compiler changes.","original_fixture":"compiler/syn/tests/fixtures/0048_bool_eq.ml","translated_fixture":"compiler/fixtures/programs/imported/syn/0048_bool_eq.ml","feature_added":"No new compiler feature; exercised bool == bool and printable bool result.","validation":"env LLVM_SYS_221_PREFIX=/opt/homebrew/opt/llvm cargo test --manifest-path compiler/stage0/Cargo.toml passed","suggested_next_fixture":"compiler/syn/tests/fixtures/0050_nested_comparison.ml"}}
{"run":25,"commit":"cad5795","metric":25,"metrics":{"wall_s":21.9},"status":"keep","description":"Imported syn 0050 nested comparison fixture with narrow constant < support","timestamp":1779141176826,"segment":0,"confidence":4,"asi":{"hypothesis":"A parser/checker case for integer less-than over constant operands can cover the nested comparison fixture when arithmetic operands are explicitly parenthesized.","original_fixture":"compiler/syn/tests/fixtures/0050_nested_comparison.ml","translated_fixture":"compiler/fixtures/programs/imported/syn/0050_nested_comparison.ml","feature_added":"Parser/checker support for < over constant integers, returning a printable bool constant.","validation":"env LLVM_SYS_221_PREFIX=/opt/homebrew/opt/llvm cargo test --manifest-path compiler/stage0/Cargo.toml passed","suggested_next_fixture":"compiler/syn/tests/fixtures/0049_comparison_chain.ml"}}
